created_utc,ups,subreddit_id,link_id,name,score_hidden,author_flair_css_class,author_flair_text,subreddit,id,removal_reason,gilded,downs,archived,author,score,retrieved_on,body,distinguished,edited,controversiality,parent_id
1430459088,2,t5_36v9d,t3_34hl7r,t1_cqurdnm,0,,,newsokur,cqurdnm,,0,0,0,anoishi,2,1432708392,含めたら１３００円いくかな 福利厚生で無意味に引かれたりするんもあるんよ… ,,0,0,t1_cqur9cm
1430459089,1,t5_324pu,t3_34hm9y,t1_cqurdnn,0,ness,,amiibo,cqurdnn,,0,0,0,toonlonkfromflorida,1,1432708392,"That isn't really too crazy it's a great deal considering figmas have higher detail and a better build quality",,0,0,t3_34hm9y
1430459089,12,t5_2qh33,t3_34g1bx,t1_cqurdno,0,,,funny,cqurdno,,0,0,0,gojetergo,12,1432708392,WHAT?? You live in anonymous proxy too??,,0,0,t1_cqua6fh
1430459089,-12,t5_2qh3l,t3_34fu8b,t1_cqurdnp,0,,,news,cqurdnp,,0,0,0,theBIGnaudd,-12,1432708392,"Please come up with revolutionary multi-billion dollar re-institutional future of agriculture or shut the fuck up already. There is not a simple solution right now for present day crop water needs. The amount of infrastructure that needs to build is beyond anything you can imagine. Yet, a fuckin high speed train is being built. And we have a fuckin oil pipeline running down the center of the continent that may or may not be used. We need more people in school and in public office willing to build something USEFUL. Until then shut the fuck up.   Every time come on here I see this kind of infantile word vomit. MF'n shit, Reddit is so full of shit. My God on and on.  Vote Wisely, get an education/job or get a bullet. ",,0,0,t1_cqujf8g
1430459089,1,t5_2qhq6,t3_34giq0,t1_cqurdnq,0,,All Forms!,yoga,cqurdnq,,0,0,0,CadenceBreak,1,1432708392,My first question would be if you generally have anger issues in daily life and perhaps this is just another expression of that?,,0,0,t3_34giq0
1430459089,2,t5_2ql0i,t3_34era2,t1_cqurdnr,0,,,manga,cqurdnr,,0,0,0,Kaizerkoala,2,1432708392,"Yuu is the extreme spectrum of what Japanese call ""herbivore men"" http://en.wikipedia.org/wiki/Herbivore_men  And you know, the end of spectrum mean you either love him or hate him.",,0,0,t1_cqu02cm
1430459089,1,t5_2si92,t3_34fkcp,t1_cqurdns,0,,,MapPorn,cqurdns,,0,0,0,Cntread,1,1432708392,The only logical next step- find the average flag color for the entire world!,,0,0,t3_34fkcp
1430459089,6,t5_36buk,t3_34fzqy,t1_cqurdnt,0,no-press,non presser,thebutton,cqurdnt,,0,0,0,Villyer,6,1432708392,"Hm that isn't satisfying. I couldn't find anything with google either. Off to math I guess.  Let's define T(n) to be the time it takes to sort n cards, where we measure time in number of shuffles (so ignoring checking and shuffling times, both of which are O(n)).  E[T(1)]=1 because trivial case.  For n cards to be shuffled, we first need to shuffle (n-1) cards, which we expect to take E[T(n-1)] time, and then get a correct bogosort of n cards which happens with probability 1/n!. The expected number of tries until a success is hit is then n! (it follows the well known geometric distribution).  Thus, E[T(n)]=E[T(n-1)]*n! (we need to sort (n-1) objects a total of n! times before we expect it to be correct). So the expected time is some superfactorial?      n  E[T(n)]     1  1     2  2     3  12     4  288     5  34560     6  24883200     7  125411328000  And I completely didn't account for any checking or shuffling. Which probably increase each final result by *at least* another n!.   So n=7 gives ~10^11. n!~10^nlogn &gt;10^n , so to reach 10^100 we only need about 15 cards.   So 15 cards will remain unshuffled till heat death of the universe?",,0,0,t1_cquqqmj
1430459089,1,t5_30zvj,t3_34gs2e,t1_cqurdnu,0,gwatch2,G Watch,AndroidWear,cqurdnu,,0,0,0,onlythecosmos,1,1432708392,"Me and my wife have SW3 and we love them. We haven't had any issues and at 11:44 pm I'm at 66%. Crazy",,0,0,t1_cqurch0
1430459089,1,t5_2t4sj,t3_34egre,t1_cqurdnv,0,flair30,,TowerofGod,cqurdnv,,0,0,0,ghost8686,1,1432708392,"They are allowed. That doesn't mean they will succeed at taking the test. They just have permission to go up to that floor.",,0,0,t1_cqunw4k
1430459089,3,t5_2vizz,t3_34f28q,t1_cqurdnw,0,,cis negatively-charged electron looking for a covalent bond,TumblrInAction,cqurdnw,,0,0,0,TinyGods,3,1432708392,This is making entirely too much sense.,,0,0,t1_cqu7ut2
1430459089,1,t5_33we4,t3_34hem5,t1_cqurdnx,0,,"Wilm and Eve, Sitting in a tree...",WastelandPowers,cqurdnx,,0,0,0,Kamica,1,1432708392,"[And for some extra flavour, the names of Den Orde des Merleu:   **Den Zukrs des Merleu**  * Zukrin Eva des Boshut * Zukr Jos des Zwerthalt * Zukrin Janke des Vorsgront * Zukr Stef des Boeutswater  **Den Stredrs des Merleu**   * Stredr Jen des Lintshol * Stredr Sendr des Ptathut * Stredr Hassn des Waterbos * Stredr Mohmed des Grunwater * Stredr Bas des Boeutsrant * Stredr Gerjen des Zwerthalt * Stredr Kespr des Waterbos * Stredr Wim des Grunwater * Stredr Twen des Ptathut * Stredr Niklas des Boeutswater  ]",,0,0,t3_34hem5
1430459089,2,t5_2tkq6,t3_34ha0x,t1_cqurdny,0,,,allthingszerg,cqurdny,,0,0,0,kingofthepotatoes8,2,1432708392,"iirc, thors lost high impact payload in exchange for an auto-repair ability much like the one in WOL campaign. better against smaller units, but not useful vs BL",,0,0,t3_34ha0x
1430459089,2,t5_2vyct,t3_34e2wc,t1_cqurdnz,0,,,swedishproblems,cqurdnz,,0,0,0,kimaro,2,1432708392,"Det är ju det! Jag förstår inte varför köpa nudlar har blivit ett liksom sätt att säga att man köper billig mat, ett paket snabb makaroner och köttbullar blir betydligt billigare än nudlar i längden.",,0,0,t1_cquertm
1430459089,4,t5_2zqh7,t3_34hlz9,t1_cqurdo0,0,Rivercats,,SacramentoRivercats,cqurdo0,,0,0,0,alwaysreadthename,4,1432708392,"I would be concerned about his defense at the major league level. He seems better suited for 1B in the Bigs. Glad to see his bat is alive and well, though. ",,0,0,t3_34hlz9
1430459089,1,t5_2sqho,t3_34dgu0,t1_cqurdo1,0,rank supreme,Supreme Master First Class,GlobalOffensive,cqurdo1,,0,0,0,Rk0,1,1432708392,"In just matchmaking or ESEA games, there aren't a lot of people that only buy normal armor without the helmet. It is most of the time only seen in the absolute top for a specific amount of reasons. Most professional teams rely heavily on flashes, smokes, molly's and all of that. When you know the enemy has AKs and AWPs, there is no reason to buy a helmet. Since both weapons instantly kill someone when hit in the head, you can better use the extra cash in buying a smoke, flash or anything like that.  When you get hit for lets say 40% armor and still have 60% left, it honestly wouldn't be worth it to reinvest in extra armor. Once it drops below 40% i'd say its best to 'refresh' your armor by buying it again. Having a lower armor percentage, doesn't mean that you take more damage or anything like that, it does nothing at all. Only when your armor reaches 0%, then it will obviously have no effect anymore.",,0,0,t1_cqufdcj
1430459090,2,t5_2qmg3,t3_34gwln,t1_cqurdo2,0,browns,Browns,nfl,cqurdo2,,0,0,0,sgSaysR,2,1432708392,Or Rugby. Never mess with a Samoan Rugby player.,,0,0,t1_cqujkcj
1430459090,5,t5_2tzdy,t3_34e8pm,t1_cqurdo3,0,,tfw vibrating hand in chest,theflash,cqurdo3,,0,0,0,EA_HYPE_TRAIN,5,1432708393,"btw, I might take a crack at recreating it. and will upload it for you all",,0,0,t1_cqur7m3
1430459090,0,t5_2zn6s,t3_34hf0y,t1_cqurdo4,0,,,BigBoobsGonewild,cqurdo4,,0,0,0,[deleted],0,1432708393,"Your right, they are perfect",,0,0,t3_34hf0y
1430459090,1,t5_2qh1i,t3_34hgls,t1_cqurdo5,0,,,AskReddit,cqurdo5,,0,0,0,[deleted],1,1432708393,[deleted],,0,0,t3_34hgls
1430459090,2,t5_2r9vp,t3_34h5tj,t1_cqurdo6,0,,,trees,cqurdo6,,0,0,0,dmasterfunk,2,1432708393,I leave the safety on my lighters never really bothered me before ,,0,0,t3_34h5tj
1430459090,2,t5_2qpol,t3_34fvyr,t1_cqurdo7,0,,,circlejerk,cqurdo7,,0,0,0,[deleted],2,1432708393,[deleted],,0,0,t3_34fvyr
1430459090,1,t5_323oy,t3_34h414,t1_cqurdo8,0,,,CasualConversation,cqurdo8,,0,0,0,[deleted],1,1432708393,[deleted],,0,0,t3_34h414
1430459090,2,t5_2s48x,t3_34glmg,t1_cqurdo9,0,,,Planetside,cqurdo9,,0,0,0,TheNineteenthDoctor,2,1432708393,"If you find that you enjoy playing in squads from a particular outfit, consider joining that outfit. The community support can be fantastic. ",,0,0,t1_cquh93i
1430459090,1,t5_2sqho,t3_34fsaq,t1_cqurdoa,0,rank supreme,Supreme Master First Class,GlobalOffensive,cqurdoa,,0,0,0,nexezz,1,1432708393,"Idk that was a long long long time ago back in DMG I don't know if I can find which demo it is lel.",,0,0,t1_cqup6b3
1430459090,6,t5_2r4b9,t3_34h5nd,t1_cqurdob,0,trans-queer,crazy Aly,asktransgender,cqurdob,,0,0,0,Alyssa_B,6,1432708393,"Sorry to hear the trans thing didnt work out for you, Ive enjoyed posting back and forth with you.  On another note though, you shouldnt be sorry for getting your identity wrong. I tried to find the other thread you talked about making and...  What you should be sorry for is your incredibly mean spirited posting in fatpeoplehate. Thats not cool, seriously.   I hope things get better for you though. Sincerely. Just stop being a jerk to people.",,0,0,t3_34h5nd
1430459090,1,t5_2qpzs,t3_34ezld,t1_cqurdoc,0,,,SuicideWatch,cqurdoc,,0,0,0,theshatteredtwo,1,1432708393,"You find the fact that I wasn't fortunate to have 99% of the people I met as good people offensive? Or the fact that I said that? So are you implicating that im lying? And ""i am not one to judge, so I wont""? You just did! And you won't be sad when I go because you know nothing about me and you think my post was offensive and insulting. You really seem like you're just here to be a troll to be honest. Not to mention the fact you had to mention that you actually ""TRIED"" to commit suicide as if to say those that haven't are less important in some kind of sense. Was that necessary in the imput? No! You could of said, I was suicidal or depressed and found people who really helped me through it. But you make it a key note that you TRIED. It's like you're trying to either guilt me or something. I should note that you probably were very open about it to others on reddit and likely in youre title which cause some needed publicity to get the 99% people you needed.",,0,0,t1_cqu7rrt
1430459090,2,t5_2qh61,t3_34g65j,t1_cqurdod,0,,,WTF,cqurdod,,0,0,0,RobinBankss,2,1432708393,"This has all been done before.  I knew I'd seen this shit before.  I had to ask my dad the name of the [puppet](https://d2nyfqh3g1stw3.cloudfront.net/photos/featured_HowdyDoody-Warhol_6723.jpg).  ",,0,0,t1_cqulwb6
1430459090,1,t5_2rt2i,t3_34axsu,t1_cqurdoe,0,,,ripcity,cqurdoe,,0,0,0,WillyTanner,1,1432708393,no to all,,0,0,t3_34axsu
1430459090,5,t5_2s450,t3_34h0jg,t1_cqurdof,0,fuckthecolts,Fuck the Colts,Texans,cqurdof,,0,0,0,Quadrophenic,5,1432708393,"Also, regardless of what you think of our pick, I think we can all agree that the Colts' was **way** shittier.",,0,0,t3_34h0jg
1430459090,34,t5_2tdzg,t3_34g1ya,t1_cqurdog,0,,,gaybros,cqurdog,,0,0,0,TheDefeatist,34,1432708393,I feel kinda lame for[ mine](http://i.imgur.com/JRqyp8p.jpg) but oh well.,,0,0,t3_34g1ya
1430459090,1,t5_31k9i,t3_34hmcx,t1_cqurdoh,0,,,bloodborne,cqurdoh,,0,0,0,AutoModerator,1,1432708393,"Your submission was automatically removed as your thread consists of only a title (sorry).   *[I am a bot](/r/AutoModerator/comments/q11pu/what_is_automoderator/), and this action was performed automatically. Please [contact the moderators of this subreddit](/message/compose?to=%2Fr%2Fbloodborne) if you have any questions or concerns.*",moderator,0,0,t3_34hmcx
1430459090,1,t5_2qkhb,t3_34dfjx,t1_cqurdoi,0,,,melbourne,cqurdoi,,0,0,0,OIP,1,1432708393,"i dunno about worst beer ever, but it is pretty fucking bad",,0,0,t1_cqtnna9
1430459090,2,t5_2qh1i,t3_34g1hc,t1_cqurdoj,0,,,AskReddit,cqurdoj,,0,0,0,ovz123,2,1432708393,"LOL that reminds me of that meme, ""You made this? *I* made this,"" but instead it's, ""Your drink? My drink.""",,0,0,t1_cquizdc
1430459091,1,t5_2rm4d,t3_34e039,t1_cqurdok,0,,,nosleep,cqurdok,,0,0,0,QuasarSandwich,1,1432708393,"We could buy him dentures. Or even make them for him ourselves. There was a thread somewhere recently about George Washington's dentures. Maybe we should take those as our model?",,0,0,t1_cquqixx
1430459091,1,t5_2tem4,t3_34f8cq,t1_cqurdol,0,steph,,dfsports,cqurdol,,0,0,0,yolo_contendere_FD,1,1432708393,yeeeeeeeeeaaaaaaaaaaaaaaa. about that,,0,0,t1_cquldpw
1430459091,3,t5_2vizz,t3_34g8za,t1_cqurdom,0,,,TumblrInAction,cqurdom,,0,0,0,DontChaseTheRabbit,3,1432708393,"what's the right amount of ""farness""? ",,0,0,t1_cqumm3v
1430459091,1,t5_2s580,t3_34hbve,t1_cqurdon,0,anubseran,,DotA2,cqurdon,,0,0,0,RebeccaBlackOps,1,1432708393,"&gt; i was playing life stealer  &gt; i soloed a 4k health pudge in literally 1,5 sec  Lifestealer's Feast deals 7% of their current HP as damage at max level. At full health, that will do ~280 damage to a Pudge ON TOP OF your auto attack damage. ~260 on the next attack, ~240 on the attack after, etc. Pudge also has shit armor, and doesn't usually build items that grant him any additional armor, meaning physical attacks are barely mitigated.   Lifestealer destroys heroes with high HP pools and low armor regardless of a Moon Shard. It's working as intended. ",,0,0,t3_34hbve
1430459091,2,t5_2qh1i,t3_34h8f8,t1_cqurdoo,0,,,AskReddit,cqurdoo,,0,0,0,Lightsworn_Redditor,2,1432708393,It would take like 5 minutes tops.,,0,0,t1_cquni9u
1430459091,1,t5_2xcmc,t3_34gzk1,t1_cqurdop,0,Yellow,"5344-0951-0375 (Jeff, Calgary)",ACTrade,cqurdop,,0,0,0,I_didnt_fart,1,1432708393,Okay do you need me to link all my stuff again or are we good?,,0,0,t1_cqurbeo
1430459091,1,t5_2ranw,t3_34h43q,t1_cqurdoq,0,,,offmychest,cqurdoq,,0,0,0,LietusRain,1,1432708393,"At my store (I work in a grocery store in the bakery) one of the upper managers gave one of the cashiers a talk about how customers are not required to respect her and can treat her really however they please. She is absolutely one of the best, most wonderful and honest people I know. I just heard this conversation, which wasn't remotely directed at me, and it hurt me. I can't imagine how it made her feel. ",,0,0,t3_34h43q
1430459091,1,t5_2qtr8,t3_34enyr,t1_cqurdor,0,blank,God of JMPI,army,cqurdor,,0,0,0,mauldms,1,1432708393,"Get over your fears,  pay attention to your training and your Jumpmasters, don't be complacent and you'll be fine.",,0,0,t1_cqugvv0
1430459091,2,t5_2qn08,t3_34gl2g,t1_cqurdos,0,,2 months,beards,cqurdos,,0,0,0,__advice__,2,1432708393,"Only 30 days? I'd have at least made him go for a proper amount of time like 60 or 90 days.",,0,0,t1_cqup017
1430459091,1,t5_2qmg3,t3_34h5qf,t1_cqurdot,0,panthers,Panthers,nfl,cqurdot,,0,0,0,alyateemwd,1,1432708393,"I up voted you, you should be allowed to share your opinion. A lot of my friends also thought this was a reach and that we probably could have gotten him in the second (even though I don't believe that).",,0,0,t1_cqumvat
1430459091,1,t5_2zc5x,t3_34hm4l,t1_cqurdou,0,360,Fallen 0nee,Fireteams,cqurdou,,0,0,0,somekindalife,1,1432708393,31 warlock GT Fallen 0nee,,0,0,t3_34hm4l
1430459091,1,t5_2qh13,t3_34gan3,t1_cqurdov,0,,,worldnews,cqurdov,,0,0,0,[deleted],1,1432708393,[deleted],,0,0,t1_cqupm19
1430459091,6,t5_2qh1i,t3_34hm49,t1_cqurdow,0,,,AskReddit,cqurdow,,0,0,0,silverblaze92,6,1432708393,All by my self,,0,0,t3_34hm49
1430459091,-3,t5_2qh61,t3_34giht,t1_cqurdox,0,,,WTF,cqurdox,,0,0,0,[deleted],-3,1432708393,[deleted],,0,1,t1_cquplvv
1430459091,8,t5_2rfxx,t3_34hm26,t1_cqurdoy,0,yasuo,,leagueoflegends,cqurdoy,,0,0,0,We-Rowdy,8,1432708393,That would be awesome!,,0,0,t1_cqurbxk
1430459091,1,t5_2qhlh,t3_34eujr,t1_cqurdoz,0,,,Documentaries,cqurdoz,,0,0,0,shieldvexor,1,1432708393,"Giving out condoms has nothing to do with economics but impulsiveness. Studies show many teens will use condoms when they're on hand but significantly less likely to get them on their own. Teens ARE going to have sex, why not make it safer?",,0,0,t1_cqu7shu
1430459091,4,t5_2xing,t3_34glph,t1_cqurdp0,0,,,RedPillWomen,cqurdp0,,0,0,0,DesertFox1986,4,1432708393,Casual sex is pretty empty for males too. Source: I am one. ,,0,0,t1_cqup7zd
1430459091,1,t5_2qh1i,t3_34hhcr,t1_cqurdp1,0,,,AskReddit,cqurdp1,,0,0,0,varthalon,1,1432708393,Cooking for one.,,0,0,t3_34hhcr
1430459091,5,t5_2qwza,t3_34hlv5,t1_cqurdp2,0,,,starbucks,cqurdp2,,0,0,0,papifatdick,5,1432708393,talk to your store manager.,,0,0,t3_34hlv5
1430459091,1,t5_2qqmk,t3_34hfk5,t1_cqurdp3,0,,,Balls,cqurdp3,,0,0,0,ddj33,1,1432708393,Thanks! So it sounds like my balls are turning you on then. ;) ,,0,0,t1_cqur7t7
1430459092,3,t5_2rgo2,t3_34c680,t1_cqurdp4,0,,,glasgow,cqurdp4,,0,0,0,jamesr74,3,1432708393,"Would like to read this but I refuse to give Buzzfeed any traffic. I suppose I could wait a couple of days for Stacey Mullen at the evening times to do her version of it. I'm pretty sure that her source material is from Reddit or Buzzfeed.",,0,0,t3_34c680
1430459092,28,t5_2ss5b,t3_34h2pg,t1_cqurdp5,0,,,SubredditDrama,cqurdp5,,0,0,0,TiredOfYourShit21,28,1432708393,"Agreed, but let me put it in a better example. Say two people eat 2000 calories. Person A has a health diet with lots of fiber from vegetables and also consumes a large amount of protein. Person B has a diet consisting mostly of carbs and sugar, low fiber and protein (which is exactly what the USDA argues for sadly, 75% of calories from carbs alone, never touch fat and only eat 50 grabs of protein a day)  Person A is going to have to try a lot less to not overeat than Person B. Most likely Person B is going to be miserable and overeat. Because their diet requires more willpower to maintain at 2000 calories than Person A  This is why proper nutrition information is crucial ",,0,0,t1_cquran0
1430459092,9,t5_2r2jt,t3_34h77r,t1_cqurdp6,0,,,TwoXChromosomes,cqurdp6,,0,0,0,digital_pimp,9,1432708393,"Weird. I'm likely biased as my now wife dated a much older guy when she was the same age as you are now. He started out in a similar way to you. It turned into a controlling and abusive relationship. One which she still bears physical scars.  I'm not saying this will happen to you but any man or woman for that matter who is actively seeking someone much younger generally cannot stand their own ground with someone who is closer to their own age and experience. .",,0,0,t3_34h77r
1430459092,1,t5_2rebv,t3_34gufn,t1_cqurdp7,0,tomsula-aquateen2,,49ers,cqurdp7,,0,0,0,corduroy_pillow,1,1432708393,me too ,,0,0,t1_cqujye4
1430459092,1,t5_2qh1i,t3_34hmde,t1_cqurdp8,0,,,AskReddit,cqurdp8,,0,0,0,AutoModerator,1,1432708393,"**PLEASE READ THIS MESSAGE IN ITS ENTIRETY BEFORE TAKING ACTION.**  Hi there! It looks like you're needing assistance of some sort. AskReddit is for thought-provoking discussion and therefore may not be suitable for what you are looking for.  **Please use one of these subreddits:**   * Need advice? /r/advice or /r/needadvice or /r/relationship_advice   * Cant remember something? /r/TipOfMyTongue    * Looking for a particular subreddit? /r/findareddit.   Otherwise if these don't fit your needs, check out the [multireddits in our sidebar](http://www.reddit.com/r/AskReddit/about/sidebar) which cover almost every topic imaginable, thanks!  If you feel this was removed in error, please [contact the mods](http://www.reddit.com/message/compose?to=%2Fr%2FAskReddit&amp;amp;subject=Help Related Post Review Request&amp;amp;message=My post was removed for being help related, please review%3a%0d%0a%0d%0ahttp%3A%2F%2Fwww.reddit.com/r/AskReddit/comments/34hmde/how_do_i_begin_to_understandcatch_up_on_current/).    *I am a bot, and this action was performed automatically. Please [contact the moderators of this subreddit](/message/compose/?to=/r/AskReddit) if you have any questions or concerns.*",moderator,0,0,t3_34hmde
1430459092,5,t5_2qhfg,t3_34e3kr,t1_cqurdp9,0,,,pcgaming,cqurdp9,,0,0,0,chozn1,5,1432708393,"Here, you have some too!!",,0,0,t1_cqurba6
1430459092,1,t5_2ub11,t3_34h13z,t1_cqurdpa,0,normalball,0275-9960-4237 IGN: Pdizzles (ΩR),Pokemongiveaway,cqurdpa,,0,0,0,ptokerT,1,1432708393,Deposited a level 1 female Abra on the GTS. Mewtwo (**Y build**) please!   IGN – Pdizzles. Thank you so much for the giveaway! ,,0,0,t3_34h13z
1430459092,2,t5_2qmg3,t3_34hbt4,t1_cqurdpb,0,saints,Saints,nfl,cqurdpb,,0,0,0,6heismans,2,1432708393,Then he would be listed as a suspect. ,,0,0,t1_cqup2o0
1430459092,2,t5_331ct,t3_34eppo,t1_cqurdpc,0,,,fivenightsatfreddys,cqurdpc,,0,0,0,NuclearSquiddy,2,1432708393,"Gonna play Grammar Nazi here:  A **theory** is an idea that can be proven/supported with cold, hard FACTS. (""Purple Guy became trapped in the Springtrap suit because it was dangerous."") These are ALWAYS canon.  A **hypothesis** is an idea based on *limited evidence*. It can be right or wrong, but until we can 100% factually prove all other explanations aren't possible, it is only a guess. (""Mangle/Foxy/Freddy caused the Bite of '87."")  Tl;dr: Theories are undeniable FACTS. Hypotheses are GUESSES.",,0,0,t3_34eppo
1430459092,5,t5_2qifr,t3_34g26g,t1_cqurdpd,0,,,Rockband,cqurdpd,,0,0,0,thekidwiththelisp,5,1432708393,"Although I still play for score a lot, most of my playing during the school year is during parties. Keeping that in mind  Toxic - Britney Spears  Closing Time - Semisonic  Party in the USA - Miley Cyrus  Ignition (Remix) - R. Kelly  The Bad Touch - Bloodhound Gang",,0,0,t3_34g26g
1430459092,1,t5_2qh1i,t3_34fvry,t1_cqurdpe,0,,,AskReddit,cqurdpe,,0,0,0,titomcfly,1,1432708393,"Dude, this sounds exactly like my old gym teacher.  We had one kid, let's say his name is Juan, who had some kind of learning disability and always looked a little smiley.  One day the gym teacher, in front of the class, goes, ""Juan! Stop smiling! What the fuck do you even have to be happy about??"" Also, on the first day of school he lined us all up and gave us each an offensive nickname.  ",,0,0,t1_cqudcg5
1430459092,1,t5_2qh2p,t3_34eiqd,t1_cqurdpf,0,no-knight,Pantheist,atheism,cqurdpf,,0,0,0,Ellytoad,1,1432708393,"When they stop quoting Leviticus, we'll stop counterquoting Leviticus.  For them to cite one verse only to pull Paul out when we call them on the other rules surrounding it is redundant.",,0,0,t1_cqugfre
1430459092,2,t5_2sazo,t3_34gu6m,t1_cqurdpg,0,,,darksouls,cqurdpg,,0,0,0,12Breacher,2,1432708393,At about the 16:20 in my video I use the skulls to burn up the Boar and around the 24:05 mark I run past the Drake. Running past everything and just having to deal with the one guy on the other side of the gate sounds like fun.,,0,0,t1_cqumxpu
1430459092,1,t5_324pu,t3_34hm9y,t1_cqurdph,0,pikachu,,amiibo,cqurdph,,0,0,0,nawk101,1,1432708393,"Well aren't figma pretty expensive? ",,0,0,t3_34hm9y
1430459092,1,t5_2y6r4,t3_34hkgh,t1_cqurdpi,0,,http://steamcommunity.com/profiles/76561198048912594,GlobalOffensiveTrade,cqurdpi,,0,0,0,Illquid,1,1432708393,"nah it won't, i did an unbox this week and the items are tradeable and marketable immediately.",,0,0,t1_cquqwod
1430459093,3,t5_2qh61,t3_34fvc8,t1_cqurdpj,0,,,WTF,cqurdpj,,0,0,0,Muzikhead,3,1432708393,"i've had a patient in my ER that during something like this would make a joke and had us all laughing.",,0,0,t1_cqu8tao
1430459093,1,t5_2qkob,t3_34enns,t1_cqurdpk,0,,,sydney,cqurdpk,,0,0,0,moomooland,1,1432708393,"lol i'm definately not spending $30 for a cd-rom just copy these photos!   technological overkill!",,0,0,t1_cquqm5g
1430459093,1,t5_2snvr,t3_34hmaz,t1_cqurdpl,0,,,FantasyPL,cqurdpl,,0,0,0,Xexox,1,1432708393,"I am kinda hating this consistency, I have taken around 7 hits in the last 17 GW's but still cant get out of this rut.",,0,0,t3_34hmaz
1430459093,1,t5_2qh3s,t3_34g1z1,t1_cqurdpm,0,,,movies,cqurdpm,,0,0,0,thegamboozler,1,1432708393,"Cool, so I can skip the shitty ones and watch the original trilogy in the theatre. They should screen IV-VI first, so it smells less horrible by the time I leave. Fucking midichlorians. ",,0,0,t3_34g1z1
1430459093,2,t5_2qh3l,t3_34hejx,t1_cqurdpn,0,,,news,cqurdpn,,0,0,0,brahmyn,2,1432708393,Hey man without meth Kenny Chesney concerts would suck!,,0,0,t1_cqupa69
1430459093,0,t5_2qh1i,t3_34hl2j,t1_cqurdpo,0,,,AskReddit,cqurdpo,,0,0,0,fallenKlNG,0,1432708393,"My life isn't necessarily bad. I'll be graduating from college with a software engineering degree a year from now. But I'm really not sure what I REALLY want to do with my life. I anticipate that in the distant future, I'd just be living an average life with a family and a nice job, maybe even a nice house. But.... is that it? While a part of me wants that, a part of me also wants... something different. I just don't know what.",,0,0,t3_34hl2j
1430459093,16,t5_2qhx4,t3_34hl5y,t1_cqurdpp,0,,,Fitness,cqurdpp,,0,0,0,[deleted],16,1432708393,[deleted],,0,0,t3_34hl5y
1430459093,11,t5_2ss5b,t3_34h2pg,t1_cqurdpq,0,,Medium-rare Realist,SubredditDrama,cqurdpq,,0,0,0,Shane_the_P,11,1432708393,"&gt; I am the internet, my default is loathing.  Guys, the internet is serious. But not as serious as your disgusting gut you fat pig, go die in a gutter! DAE white people are actually the ones that are being held down by all the pro-equality people?",,0,0,t3_34h2pg
1430459093,1,t5_2ru8r,t3_34hbn7,t1_cqurdpr,0,,,uvic,cqurdpr,,0,0,0,gettingthere000,1,1432708393,"great, thanks for the response :) ",,0,0,t1_cquqqat
1430459093,2,t5_2qmg3,t3_34hm19,t1_cqurdps,0,eagles,Eagles,nfl,cqurdps,,0,0,0,DownTrunk,2,1432708393,Gregory?,,0,0,t1_cqurbig
1430459093,1,t5_2r9vp,t3_34fv7y,t1_cqurdpt,0,,,trees,cqurdpt,,0,0,0,yN_,1,1432708393,Cross blizzoint ,,0,0,t3_34fv7y
1430459093,1,t5_2roa2,t3_340rz5,t1_cqurdpu,0,,,AirForce,cqurdpu,,0,0,0,[deleted],1,1432708393,[deleted],,0,0,t1_cqur6h0
1430459093,1,t5_2qq5c,t3_34hm88,t1_cqurdpv,0,,,gonewild,cqurdpv,,0,0,0,[deleted],1,1432708393,"Absolutely ;) PM me,  and let's have some fun :)",,0,0,t3_34hm88
