created_utc,ups,subreddit_id,link_id,name,score_hidden,author_flair_css_class,author_flair_text,subreddit,id,removal_reason,gilded,downs,archived,author,score,retrieved_on,body,distinguished,edited,controversiality,parent_id
1430459116,17,t5_351zk,t3_34hki6,t1_cqurdyw,0,white,kaffir,CoonTown,cqurdyw,,0,0,0,Oliver_Thambo,17,1432708396,"When we do we’re labelled as racist. In my country (South Africa)  peaceful protestors, who don’t destroy cities or anything like that, who protest the death of innocent white civilians are called racist and regressive. Even though they have far more to fear from interracial violence than the looting gibbons in Baltimore.",,0,0,t3_34hki6
1430459116,1,t5_2wbww,t3_34hkfg,t1_cqurdyx,0,,,2007scape,cqurdyx,,0,0,0,1wolfbane1,1,1432708396,"I just got an elite from ""not to easy not to hard"" trying to get a medium sadly had to drop it",,0,0,t1_cqur3nf
1430459116,1,t5_2rfqu,t3_34hmdz,t1_cqurdyy,0,,,fakeid,cqurdyy,,0,0,0,AutoModerator,1,1432708396,"Hello /u/emmanem916, this post has been automatically removed due to mentioning IDGod.  If you have any questions regarding IDGod or ordering from him, please use the search bar and read the [FAQ](http://www.reddit.com/r/fakeid/wiki/faq). If your question remains unanswered, please redirect your question to /r/idg0d. That subreddit is dedicated to IDGod and answering any questions you may have about him.  If you feel like this removal was made in error or you feel that your post belongs on /r/fakeid, please message the moderators or tag one of the active moderators for manual post approval.  *[I am a bot](/r/AutoModerator/comments/q11pu/what_is_automoderator/), and this action was performed automatically. Please [contact the moderators of this subreddit](/message/compose?to=%2Fr%2Ffakeid) if you have any questions or concerns.*",moderator,0,0,t3_34hmdz
1430459116,24,t5_2s580,t3_34hllq,t1_cqurdyz,0,teamnavi,,DotA2,cqurdyz,,0,0,0,Childplay534,24,1432708396,theyre all so meh  i dont think its even going to go over 7m,,0,1,t1_cqurd6f
1430459116,1,t5_2ub11,t3_34h13z,t1_cqurdz0,0,normalball,4656-9004-5838 | IGN: deathfrenzy,Pokemongiveaway,cqurdz0,,0,0,0,deathfrenzy69,1,1432708396,Ignore the last request part i might ask for one more.. or not if it runs out by then haha,,0,0,t1_cquqyjx
1430459116,1,t5_2qh4j,t3_34g2ev,t1_cqurdz1,0,,,europe,cqurdz1,,0,0,0,[deleted],1,1432708396,[deleted],,0,0,t3_34g2ev
1430459116,1,t5_37yio,t3_34ai6g,t1_cqurdz2,0,,,BreakingBumps,cqurdz2,,0,0,0,[deleted],1,1432708396,[deleted],,0,0,t1_cqui7cu
1430459117,1,t5_2sqpa,t3_34c65e,t1_cqurdz3,0,,,MovieSuggestions,cqurdz3,,0,0,0,TheCousinEddie,1,1432708396,Cacoon,,0,0,t3_34c65e
1430459117,-1,t5_2qh1i,t3_34h6kg,t1_cqurdz4,0,,,AskReddit,cqurdz4,,0,0,0,ErionFish,-1,1432708396,why are you people at negative points?,,0,0,t1_cquovqc
1430459117,7,t5_2rk3b,t3_34g4p7,t1_cqurdz5,0,,,civ,cqurdz5,,0,0,0,Nihilophobe,7,1432708396,"I guess at that point you're committed. Or possibly should be committed.",,0,0,t1_cquoqxs
1430459117,1,t5_2qhlh,t3_34hmdj,t1_cqurdz6,0,,,Documentaries,cqurdz6,,0,0,0,AutoModerator,1,1432708396,"Your submission has been automatically removed because you didn't include the year in the title or because you didn't use the correct format.  **The (year) tag at the end of your title is mandatory.**  Please make sure to format your title using this format : **DocumentaryTitle (year) - ""short description of the documentary""**  (Note that the description is optional, but encouraged.)  Thanks.   *[I am a bot](/r/AutoModerator/comments/q11pu/what_is_automoderator/), and this action was performed automatically. Please [contact the moderators of this subreddit](/message/compose?to=%2Fr%2FDocumentaries) if you have any questions or concerns.*",moderator,0,0,t3_34hmdj
1430459117,2,t5_2qq5c,t3_34hka2,t1_cqurdz7,0,,,gonewild,cqurdz7,,0,0,0,Califbored,2,1432708397,Lovely!,,0,0,t3_34hka2
1430459117,1,t5_2qh1i,t3_34h9xp,t1_cqurdz8,0,,,AskReddit,cqurdz8,,0,0,0,ThePeoplesCheese,1,1432708397,"Don't we all use butter? I feel like the directions are just wrong",,0,0,t1_cqunwyi
1430459117,6,t5_2qh3s,t3_34g1z1,t1_cqurdz9,0,,,movies,cqurdz9,,0,0,0,Owyn_Merrilin,6,1432708397,"AOTC sucks, much worse than TPM. The only reason people think it was better is because expectations were a lot lower by the time it came out.",,0,0,t1_cqunzch
1430459117,2,t5_2s580,t3_34hllq,t1_cqurdza,0,,,DotA2,cqurdza,,0,0,0,rcsale,2,1432708397,No hero remodel vote? :(,,0,0,t3_34hllq
1430459117,9,t5_2qh4i,t3_34h2s5,t1_cqurdzb,0,,,books,cqurdzb,,0,0,0,aspct,9,1432708397,If you made it to Dead Beat you clearly have no intention of giving up.,,0,0,t1_cqur00u
1430459117,1,t5_2qh33,t3_34fn62,t1_cqurdzc,0,,,funny,cqurdzc,,0,0,0,thefluffyburrito,1,1432708397,"Kidding aside, my sister used to work at a store that sold children's school supplies and every single day she'd get someone in with the question ""I think my child is a genius, do you guys have books about that?""  ",,0,0,t3_34fn62
1430459117,1,t5_2qh1i,t3_34hkh4,t1_cqurdzd,0,,,AskReddit,cqurdzd,,0,0,0,HazyLooks,1,1432708397,I was like spaced out and this came to my mind. Maybe that funny tasting coke at the taco stand was spiked...,,0,0,t1_cquqx7g
1430459117,1,t5_2qh2v,t3_34hhhh,t1_cqurdze,0,,,China,cqurdze,,0,0,0,bogankid420,1,1432708397,"Things are priced for the region. Businesses know who their target market is and what they can afford. In China upper class people spend less on housing and food than upper class westerners, and like to spend more on clothing and things everyone can see. This is just a known fact, so you'll see a pair of sunglasses that are $150 in the US are $300 here, shoes might be $300 are $500, buying wine at a bar/restaurant here might cost $60 instead of $30, etc...  America is pretty much the cheapest place in the world for shopping, I don't know anywhere you can buy luxury/clothing/electronics cheaper than the US. ",,0,0,t3_34hhhh
1430459118,2,t5_2qi58,t3_34fqu3,t1_cqurdzf,0,2,Manchester United,soccer,cqurdzf,,0,0,0,teppistello,2,1432708397,wow.,,0,0,t3_34fqu3
1430459118,1,t5_34k5q,t3_34cchw,t1_cqurdzg,0,asclepius,Counselor of Asclepius,CampHalfBloodRP,cqurdzg,,0,0,0,alaqazam,1,1432708397,"Damn... You're good xD",,0,0,t1_cqug35g
1430459118,5,t5_2x9xz,t3_34g2r2,t1_cqurdzh,0,,,fatpeoplehate,cqurdzh,,0,0,0,Freiherr_von_Kuehnle,5,1432708397,You reminded me how happy I was to switch from accounting to finance,,0,0,t1_cqul1ob
1430459118,3,t5_2qorf,t3_34g4f7,t1_cqurdzi,0,,,Anarcho_Capitalism,cqurdzi,,0,0,0,conradsymes,3,1432708397,"&gt; tend to take the word of 'experts' as infallible gospel in a manner similar to the way you suggest.   I know I don't understand evil. But I'm not convinced even Pope Francis understands the concept.",,0,0,t1_cqulrxk
1430459118,1,t5_2vqni,t3_34hjui,t1_cqurdzj,0,,,DarkSouls2,cqurdzj,,0,0,0,crux-of-the-biscuit,1,1432708397,"Thanks for the advice. As far as story goes, does DSII continue where the first one left off or is it a standalone story line? Or is there even a story to be had? I can't imagine being able to pay attention to a story amidst all the dying. Lol",,0,0,t1_cqur87b
1430459118,1,t5_2qh2t,t3_34fg54,t1_cqurdzk,0,,,chicago,cqurdzk,,0,0,0,PowerSystemsGuy,1,1432708397,J-E-T-S SUCK! SUCK! SUCK!,,0,0,t1_cqumm7u
1430459118,2,t5_2qzxo,t3_34gize,t1_cqurdzl,0,,,Albany,cqurdzl,,0,0,0,blue_barracuda,2,1432708397,wayyyy too long man. ,,0,0,t1_cqurclm
1430459118,1,t5_2qh1i,t3_34g989,t1_cqurdzm,0,,,AskReddit,cqurdzm,,0,0,0,whoami135,1,1432708397,"2 on my knee, one from surgery, the other from falling down when I was walking to the car.",,0,0,t3_34g989
1430459118,2,t5_2qnd8,t3_34f0b7,t1_cqurdzn,0,,,Chattanooga,cqurdzn,,0,0,0,fire84,2,1432708397,"My phone sent a little early, but to finish my thought, they are a not-for-profit business, but they still need to have the business sense to manage their money wisely.",,0,0,t1_cquqcf0
1430459118,1,t5_2qh16,t3_34gsns,t1_cqurdzo,0,,,technology,cqurdzo,,0,0,0,[deleted],1,1432708397,[deleted],,0,0,t1_cquqqjf
1430459118,2,t5_2s580,t3_34hlur,t1_cqurdzp,0,tresdin,,DotA2,cqurdzp,,0,0,0,Sedition7988,2,1432708397,"uggggggh. Why does the bristelback announcer have to be behind a 13 million dollar wall. Fuckin' Valve, you know we'd rain down shekels in droves for it if we don't reach the goal. I hope it's free if we reach the goal, at least.",,0,0,t3_34hlur
1430459118,1,t5_2qh3s,t3_34fdua,t1_cqurdzq,0,,,movies,cqurdzq,,0,0,0,BetterCallSal,1,1432708397,"There's apparently a whole part of the movie I've never seen ",,0,0,t3_34fdua
1430459118,26,t5_2qo4s,t3_34hk76,t1_cqurdzr,0,,,nba,cqurdzr,,0,0,0,500poundcake,26,1432708397,I thought that one play from the Cavs series where LeBron was in-bounding the ball and Isaiah Thomas was guarding him from behind was surely gonna be on Shaqtin. That was hilarious. ,,0,0,t3_34hk76
1430459118,3,t5_2qmg3,t3_34h4fy,t1_cqurdzs,0,broncos,Broncos,nfl,cqurdzs,,0,0,0,FWcodFTW,3,1432708397,"If we're in a 3-4, won't ware be a linebacker?",,0,0,t1_cqumnqb
1430459118,2,t5_2qh4p,t3_34d0bv,t1_cqurdzt,0,,,firefox,cqurdzt,,0,0,0,Nocturne501,2,1432708397,"Couldn't agree more. The number of times Firefox randomly froze thanks to Shockwave was infuriating. ",,0,0,t1_cququyo
1430459119,1,t5_2qhl2,t3_34f4h8,t1_cqurdzu,0,,,cars,cqurdzu,,0,0,0,notarapist72,1,1432708397,"Ugh, those aren't white walls.. Just grey plastic rings clipped on",,0,0,t3_34f4h8
1430459119,3,t5_2qh61,t3_34fmhj,t1_cqurdzv,0,,,WTF,cqurdzv,,0,0,0,DerBroeckel,3,1432708397,"I never said that you said it wasn't :D ",,0,0,t1_cqur9tt
1430459119,1,t5_323oy,t3_34hggf,t1_cqurdzw,0,blue,sup,CasualConversation,cqurdzw,,0,0,0,passwordsarehardd,1,1432708397,"Your twitter bio should be ""Give me your NICE SOCKS for my birthday. I don't want any uncool socks."" I'm out of questions. ",,0,0,t1_cqurbx7
1430459119,1,t5_2qkob,t3_34enns,t1_cqurdzx,0,,,sydney,cqurdzx,,0,0,0,moomooland,1,1432708397,called surry hills library and circular quay library and no luck there unfort!,,0,0,t1_cqupuar
1430459119,-1,t5_2s580,t3_34hmbr,t1_cqurdzy,0,,,DotA2,cqurdzy,,0,0,0,[deleted],-1,1432708397,[deleted],,0,0,t3_34hmbr
1430459119,1,t5_2xs2w,t3_3444bi,t1_cqurdzz,0,,,RapWars,cqurdzz,,0,0,0,elsiniestro,1,1432708397,"*shrugs*   Just not my thing, see I read bars like Chester's in this battle and I don't feel them for the most part. I don't get impressed by a punch if the bars aren't technical. Different stroke for different folks!",,0,0,t1_cqur3n3
1430459119,2,t5_2r2o9,t3_34hlzc,t1_cqure00,0,,,asoiaf,cqure00,,0,0,0,aSc4rYGh0sT,2,1432708397,"1) Ned Dayne has no idea what he's talking about. He's much too young (younger than Jon) to know for a fact who Jon's mother is. He's working off of rumor, just like everyone who isn't Ned Stark or Howland Reed.   2) One of the common rumors is that Wylla, a wet nurse servant from Starfall, is Jon's mother. Ned Dayne is just repeating this rumor.    ",,0,0,t3_34hlzc
1430459119,1,t5_2qmlu,t3_34hm4w,t1_cqure01,0,,,electronic_cigarette,cqure01,,0,0,0,pheonixxx1987,1,1432708397,0.10 -3.0 ohms. Not 0.3. ,,0,0,t3_34hm4w
1430459119,17,t5_2xpsy,t3_34hkwv,t1_cqure02,0,,,BABYMETAL,cqure02,,0,0,0,monsterpanda,17,1432708397,Yui-chan Maji Baby-chan  * https://pbs.twimg.com/media/CD5UlVUUUAAkOCN.png * https://pbs.twimg.com/media/CD5UjOdVEAAM7GB.png * https://pbs.twimg.com/media/CD5L-WeUUAAt3PW.png * https://pbs.twimg.com/media/CD5BLlOVAAAl9Hf.jpg,,0,0,t3_34hkwv
1430459119,1,t5_2t1o8,t3_34fozf,t1_cqure03,0,,,Zippo,cqure03,,0,0,0,TFiOS,1,1432708397,Looks like I would have to fill this every 4 or 5 days instead of two weeks. It looks neat though! ,,0,0,t3_34fozf
1430459120,1,t5_2qixk,t3_34cw6i,t1_cqure04,0,,,halo,cqure04,,0,0,0,scoobythebeast,1,1432708397,"Mendez already did voice recording for Hunt the Truth so I don't think that could be it.",,0,0,t1_cqtwalf
1430459120,2,t5_2sokd,t3_34el7h,t1_cqure05,0,,,explainlikeimfive,cqure05,,0,0,0,IronBallsOfKnowledge,2,1432708397,"I don't get it",,0,0,t1_cqu03e2
1430459120,2,t5_2sokd,t3_34hm73,t1_cqure06,0,,,explainlikeimfive,cqure06,,0,0,0,Darkchyylde,2,1432708397,No. The laptop takes a larger charge than the phone so more juice is going in to the battery than is coming out into the phone. ,,0,0,t3_34hm73
1430459120,1,t5_31hxu,t3_34h87c,t1_cqure07,0,,,waywardsouls,cqure07,,0,0,0,Mik0ri,1,1432708397,"It's not that long. Just keep at it for a little while.",,0,0,t1_cquqkdr
1430459120,1,t5_2sm62,t3_34gx6f,t1_cqure08,0,,,overlanding,cqure08,,0,0,0,merrigoldie,1,1432708397,"Man, that's such a cool van! What is it, and what modifications did you make?   We were in the cedar mesa area (canyoneering, not overlanding) just a couple of weekends ago...it's so beautiful. Looks like we need to figure out some stuff to do in Nevada and the other places you showed too!",,0,0,t1_cquo9f2
1430459120,1,t5_2qh33,t3_34gren,t1_cqure09,0,,,funny,cqure09,,0,0,0,SlashStar,1,1432708397,"""What should I do to maximize my happiness""",,0,0,t1_cquk0au
1430459120,1,t5_2qhqb,t3_34dii9,t1_cqure0a,0,cnty-expat,Tokyo,unitedkingdom,cqure0a,,0,0,0,lemonfighter,1,1432708397,Same here... No vote for me...,,0,0,t1_cquicyf
1430459120,1,t5_2qh8e,t3_34gp97,t1_cqure0b,0,,,australia,cqure0b,,0,0,0,RandomUser1076,1,1432708397,"I'm pretty sure that's for war not for your own people. Like non fragmenting bullets.",,0,0,t1_cqunm6w
1430459120,2,t5_2vhg0,t3_34hdi3,t1_cqure0c,0,pyrrah1,And then there were five,RWBY,cqure0c,,0,0,0,Uhh_ICanExplain,2,1432708397,I might do the thing that I did before where I forget to read it for the next month and then suddenly I have 30 chapters to read in one sitting.,,0,0,t1_cqura64
1430459120,3,t5_2s580,t3_34hlur,t1_cqure0d,0,terrorblade,Icefrog plz fix my hero,DotA2,cqure0d,,0,0,0,Swaginitus,3,1432708397,&gt; Stretch goal reward items will be released soon after they are unlocked.  Topest of Keks,,0,0,t3_34hlur
1430459120,1,t5_2qnts,t3_34e0id,t1_cqure0e,0,,,nottheonion,cqure0e,,0,0,0,[deleted],1,1432708397,[deleted],,0,0,t3_34e0id
1430459120,1,t5_2r4w1,t3_347wzy,t1_cqure0f,0,,,promos,cqure0f,,0,0,0,[deleted],1,1432708397,[deleted],,0,0,t3_347wzy
1430459120,1,t5_2qh13,t3_34gan3,t1_cqure0g,0,,,worldnews,cqure0g,,0,0,0,jstevewhite,1,1432708397,"I don't have to, if they're paying attention.",,0,0,t1_cqupnwh
1430459120,1,t5_2qt55,t3_34fx8j,t1_cqure0h,0,,,gifs,cqure0h,,0,0,0,B0NERSTORM,1,1432708397,"So what's happening is as the energy is leaving the water the H20 molecules no longer have the energy to be ""loose"" and they're starting to snap into place perpendicular to each other, which is causing the volume to increase?  Are the air bubbles the dissolved oxygen in the water being pushed out by the freezing?",,0,0,t3_34fx8j
1430459121,1,t5_2sokd,t3_34hkcm,t1_cqure0i,0,,,explainlikeimfive,cqure0i,,0,0,0,MeowMixSong,1,1432708397,"Well, the TV in my bedroom is just getting analog NTSC service from the cable company, and the TV in my livingroom is getting QAM/NTSC from the cable company, (depending on the channel), or MPEG2 when I have it switched over to satellite.  I've also noticed that if I tune to the same feed, (same channel), that NTSC looks better on my old CRT TV, but looks like shit on my LCD TV. even when properly scaled.    **EDIT:** I just tuned to an NTSC feed on my widescreen, and with the aspect ratio set proper, it's equivalent to a 32"" 4:3 TV.  So, I guess overall area on a widescreen TV is smaller than an old fashioned CRT TV.  (god damn, I never thought I would call CRT TV's ""old"".  Shit, I remember when my mother first got cable, the cable box didn't even have a remote, and it had a slider on the top of the box to change the channels).",,1430459402,0,t1_cqurai9
1430459121,1,t5_2qh3l,t3_34g48z,t1_cqure0j,0,,,news,cqure0j,,0,0,0,LaceratedCantaloupe,1,1432708397,"Were there no security cameras along the route?  I feel like there had to be at least one or two that had the van in sight, especially at an intersection where they could do some real damage.",,0,0,t1_cqunmah
1430459121,2,t5_2qh1u,t3_34goss,t1_cqure0k,0,,,Music,cqure0k,,0,0,0,thekillinapill,2,1432708397,lol I just started using it like 2 days ago,,0,0,t3_34goss
1430459121,-3,t5_2r2jt,t3_34h77r,t1_cqure0l,0,,,TwoXChromosomes,cqure0l,,0,0,0,for_forever,-3,1432708397,"I dated a girl and our ages were very similar to yours.  He might just honestly like you, who knows.  I know in our situation we were both in love and age really was just a number.  We dated for 3 years before it ended.  Like some others have commented, we did have to lie about certain things, but it wasn't a huge deal.  Her parents were cool with it, mine were okay with it.  Honestly he could be a nice guy or a creep, it's impossible to tell.  You could give it a shot and don't do ANYTHING you feel uncomfortable doing, or you could ask him to wait a while, or just ignore it.  Best of luck ",,0,0,t3_34h77r
1430459121,2,t5_2s7tt,t3_34hijt,t1_cqure0m,0,,,AdviceAnimals,cqure0m,,0,0,0,BlueSapphire21,2,1432708397,is it? aww damn my bad xD,,0,0,t1_cquraqr
1430459121,1,t5_2uii8,t3_34gy5s,t1_cqure0n,0,,,marvelstudios,cqure0n,,0,0,0,Tetsujin_MK,1,1432708397,Ended up on the cutting room floor.,,0,0,t1_cquqrdd
1430459121,1,t5_2ruqw,t3_34gu6i,t1_cqure0o,0,odell-catch,,NYGiants,cqure0o,,0,0,0,SerHodorTheThrall,1,1432708397,"Once we get a real LT, we'll be in the clear for a long time. ",,0,0,t1_cquitzk
1430459121,1,t5_2yt52,t3_34hmar,t1_cqure0p,0,butterfree volbeat heracross bug,"Nazca 1246-8800-6761 [Bug:Butterfree,Volbeat,Heracross]",friendsafari,cqure0p,,0,0,0,Astaryi,1,1432708397,Very great safari ! Can you add me?         Thanks - Nazca  ,,0,0,t3_34hmar
1430459121,1,t5_2r9vp,t3_34fzk9,t1_cqure0q,0,,,trees,cqure0q,,0,0,0,coastalcaveman,1,1432708397,"Alright. Won me over with everything else. Now this? Hello Mr. Sanders, you've got a volunteer",,0,0,t3_34fzk9
1430459121,1,t5_2qh1i,t3_34hhcr,t1_cqure0r,0,,,AskReddit,cqure0r,,0,0,0,goob3r11,1,1432708397,"I don't really know much about LoL, but i'll try to help with CoD (I played the original-MW2):  * I found that the best way to play was to find a weapon that you really like and do well with, find out it's strengths/weaknesses and change your playstyle to match them.   * Get to know the maps, find all the choke points and good places to hide briefly (to regen health), and work to get to them if you choose say a shotgun or an AR.   * If you're like me and like to snipe, find somewhere that there is a lot of cover but still gives you great sightlines to where the enemies are.  * *Always keep moving!* Sitting in one spot is the easiest way to get killed.   * Stick with teammates that are at or above your skill level, they'll generally cover your back or at least be more attuned to the map and see enemies possibly before you even do.  I play quite a bit of Destiny and it's much the same thing, it's common in FPS.   I hope this helps!",,0,0,t1_cqur7fs
1430459122,1,t5_2qhx4,t3_34gkf9,t1_cqure0s,0,,,Fitness,cqure0s,,0,0,0,diaper_fuck,1,1432708397,"Yeah! I already do that one! I have tons of lower back pain though, it's awful, tips for tall guy deads?",,0,0,t1_cquqga4
1430459122,1,t5_2qh1i,t3_34fvry,t1_cqure0t,0,,,AskReddit,cqure0t,,0,0,0,take2thesea,1,1432708397,Thanks you too,,0,0,t1_cquq95b
1430459122,1,t5_2qh7l,t3_34h5mw,t1_cqure0u,0,,,Drugs,cqure0u,,0,0,0,roionsteroids,1,1432708397,Check out our Wiki pages on [**common drugs**](/r/Drugs/wiki/drugs) and the [**drug knowledge base**](/r/Drugs/wiki/knowledgebase) or use the search option to the right and then feel free to come back with any unanswered questions.  [Post removed],,0,0,t3_34h5mw
1430459122,2,t5_2qq5c,t3_34hdw4,t1_cqure0v,0,,,gonewild,cqure0v,,0,0,0,jwillya,2,1432708397,BootySama = ERECTION WITH PERFECTION !!! Oooooh laaaawd have mercy.... I just wanna stare into those big beautiful eye... eye... eye....I...I mean big beautiful tits 4EVER !! Completely Covered in Sexy.,,0,0,t3_34hdw4
1430459122,3,t5_2qibp,t3_34hi0n,t1_cqure0w,0,,,Sprint,cqure0w,,0,0,0,skyxsteel,3,1432708397,"Please don't. Unauthorized tethering was one of the reasons why AT&amp;T and Verizon killed unlimited plans. Don't give Sprint a reason to either.",,0,0,t3_34hi0n
1430459122,1,t5_2vq0w,t3_34g9x9,t1_cqure0x,0,SigiloftheEternalNight,,DestinyTheGame,cqure0x,,0,0,0,reboot-it,1,1432708397,"Train with all your might, versusthestream! Surely then senpai will notice you!  Ganbatte!",,0,0,t3_34g9x9
1430459122,1,t5_2qh1i,t3_34hm9o,t1_cqure0y,0,,,AskReddit,cqure0y,,0,0,0,SkolDog,1,1432708397,Getting tattoos. ,,0,0,t3_34hm9o
1430459122,5,t5_2uqat,t3_34dwsc,t1_cqure10,0,,,eu4,cqure10,,0,0,0,jamesk2,5,1432708397,"Yin/Yang shits are from Taoism, not Confucianism. Confucianism is about the social interaction between rulers/retainers, husband/wife, father/son...",,0,0,t1_cqui387
1430459122,3,t5_2szyo,t3_34f8qj,t1_cqure11,0,,,Showerthoughts,cqure11,,0,0,0,subredditChecker,3,1432708397,"&gt; There doesn't seem to be anything here    *****    ^^As ^^of: ^^05:45 ^^05-01-2015 ^^UTC. ^^I'm ^^checking ^^to ^^see ^^if ^^the ^^above ^^subreddit ^^exists ^^so ^^you ^^don't ^^have ^^to! ^^Downvote ^^me ^^and ^^I'll ^^disappear!",,0,0,t1_cqurdl9
1430459122,-1,t5_2s417,t3_34hcb7,t1_cqure12,0,mspitfire,,DFO,cqure12,,0,0,0,steel6,-1,1432708397,"no sprites lol, recolored sprite mods",,0,0,t1_cqur8mu
1430459122,1,t5_2rnve,t3_344rds,t1_cqure13,0,,,buildapc,cqure13,,0,0,0,XorFish,1,1432708397,"I don't really have experience with tvs, sorry.",,0,0,t1_cquqxab
1430459122,4,t5_2qh3l,t3_34g48z,t1_cqure14,0,,,news,cqure14,,0,0,0,Neri25,4,1432708397,"DA's aren't an outside body, they're the public facing branch of the same cumstain.",,0,0,t1_cquob07
1430459122,2,t5_37pmn,t3_31radj,t1_cqure15,0,,,VioletHand,cqure15,,0,0,0,Desthion,2,1432708397,"I,/u/Desthion, accept that I am, as a Purple, superior to all other colors because of my Button-granted right. In addition, I accept the Hierarchy of Purple and swear that my ultimate goal is to allow The Timer to reach Zero.  Through all means, prove supremacy. Hail the Violet Hand.",,0,0,t3_31radj
1430459122,1,t5_2rd9v,t3_34hkjr,t1_cqure16,0,,,FoodPorn,cqure16,,0,0,0,[deleted],1,1432708397,[deleted],,0,0,t3_34hkjr
1430459122,1,t5_2zc5x,t3_34hmd0,t1_cqure17,0,,,Fireteams,cqure17,,0,0,0,surensm,1,1432708397,"we have a group of 4, add: theultimateczar",,0,0,t3_34hmd0
1430459122,1,t5_2qh61,t3_34egmb,t1_cqure18,0,,,WTF,cqure18,,0,0,0,Ziczak,1,1432708397,Care to expand upon what they checked or how deeply?,,0,0,t1_cqur9pc
1430459122,8,t5_2qt55,t3_34gidx,t1_cqure19,0,,,gifs,cqure19,,0,0,0,Sengura,8,1432708397,Really? They became millionaires?,,0,0,t1_cqur4iw
1430459123,1,t5_2s0u3,t3_34en7g,t1_cqure1a,0,homer,,CHIBears,cqure1a,,0,0,0,Joliet_Jake_Blues,1,1432708397,Fire Pace.  Fire Fox.  Start over.,,0,0,t3_34en7g
1430459123,1,t5_37js8,t3_34hjzj,t1_cqure1b,0,,,HaloOnline,cqure1b,,0,0,0,[deleted],1,1432708397,[deleted],,0,0,t1_cqur6vz
1430459123,1,t5_2qjdm,t3_34gszl,t1_cqure1c,0,,,Advice,cqure1c,,0,0,0,Clarkmandi,1,1432708397,Reno NV. All the casinos are sold out. ,,0,0,t1_cquqn7p
1430459123,1,t5_2ub11,t3_34h13z,t1_cqure1d,0,normalball,4553-9993-2531 | IGN: Dylan,Pokemongiveaway,cqure1d,,0,0,0,dylanh3x3,1,1432708397,Deposited level 13 male electrike for cresselia  Ign Dylan  Thanks very much!,,0,0,t3_34h13z
1430459123,1,t5_2ub11,t3_34h13z,t1_cqure1e,0,normalball,3222-5873-8896 IGN: Akira,Pokemongiveaway,cqure1e,,0,0,0,AkiraTrucido,1,1432708397,Black. If you still have it. My internet cut out. Dx If not oh well. ,,0,0,t1_cqur42f
1430459123,1,t5_2qh33,t3_34gren,t1_cqure1f,0,,,funny,cqure1f,,0,0,0,peskoly,1,1432708397,"It's kind of funny...",,0,0,t3_34gren
1430459123,1,t5_2s580,t3_34gw2d,t1_cqure1g,0,balanar,,DotA2,cqure1g,,0,0,0,Whatsdota,1,1432708397,"It's because people just do that stupid farm aghs for everyone on the team instead of taking advantage of the fact rubberband got nerfed. Also the overall gold gain from creeps got nerfed, making Alchemist comparatively farm so much faster than anyone.",,0,0,t1_cqujhnj
1430459123,1,t5_2qhx4,t3_34gkf9,t1_cqure1h,0,,,Fitness,cqure1h,,0,0,0,Wet_Walrus,1,1432708397,"Very True. OP great post, you should put this up at /r/bodybuilding as well. ",,0,0,t1_cqukl1h
1430459123,2,t5_2qh1i,t3_34hk5n,t1_cqure1i,0,,,AskReddit,cqure1i,,0,0,0,Maddchemist94,2,1432708397,"I just achieved that state and it is wonderful. I wouldn't say I am isolated as much as I just do my own thing. I am not the type who is desperately trying to get married and have a man on my arm at all times and I don't judge my self worth on my friends but rather my accomplishments. Life is just so much easier that way. I am enjoying it. I still go on dates and stuff, but now I am a little more picky so it tends to be nice, classy dates where I am treated like a real lady. Keeping away from most people is great because they only bring this element of negativity and drama to my life that I really don't need.",,0,0,t1_cqur9mr
1430459123,14,t5_2qhkb,t3_34gwgh,t1_cqure1j,0,,,Colorado,cqure1j,,0,0,0,Montuckian,14,1432708397,"We'll just send in the pelican-eating gorillas, who will simply die off next winter.",,0,0,t1_cqur6sg
1430459123,2,t5_2qh1i,t3_34ffhl,t1_cqure1k,0,,,AskReddit,cqure1k,,0,0,0,something_other,2,1432708397,"Me too! 34 with a master's degree. It's never grad school or undergrad, always high school. ",,0,0,t1_cqucf1m
1430459123,2,t5_2wxgg,t3_34g47z,t1_cqure1l,0,,,galaxynote4,cqure1l,,0,0,0,[deleted],2,1432708397,[deleted],,0,0,t3_34g47z
