created_utc,ups,subreddit_id,link_id,name,score_hidden,author_flair_css_class,author_flair_text,subreddit,id,removal_reason,gilded,downs,archived,author,score,retrieved_on,body,distinguished,edited,controversiality,parent_id
1430459072,1,t5_2znbs,t3_34g46d,t1_cqurdgn,0,,tomato hoarder,skyrimrequiem,cqurdgn,,0,0,0,saltyshanty,1,1432708390,"The actual ""dodge"" skill does look weird in 3rd person, but I was thinking of just maneuvering around attacks, rather than using the ""dodge"" skill.  I find it a lot easier to avoid attacks from multiple enemies in 3rd person, as you can watch your flanks more easily, and it's harder to get tripped up on terrain.  Also, avoiding attacks by moving backwards is more efficient if you do it by facing perpendicular to your target and side-stepping, and it's easier to do that in 3rd for me.  ",,0,0,t1_cquf884
1430459072,1,t5_2vsga,t3_34b0xc,t1_cqurdgo,0,,,XWingTMG,cqurdgo,,0,0,0,Mirkon,1,1432708390,"That's really awesome !",,0,0,t1_cqtcn8o
1430459072,2,t5_2qkog,t3_34gi8j,t1_cqurdgp,0,,,london,cqurdgp,,0,0,0,ianvisits,2,1432708390,https://www.citizensadvice.org.uk/housing/repairs-in-rented-housing/disrepair-what-are-your-options-if-you-are-a-private-rented-tenant/disrepair-what-are-your-options-if-you-are-a-private-rented-tenant/,,0,0,t3_34gi8j
1430459073,3,t5_2s8vl,t3_34hfxr,t1_cqurdgq,0,00turk,,LAClippers,cqurdgq,,0,0,0,glennrice,3,1432708390,"Let's get this win!",,0,0,t1_cqur7ct
1430459073,1,t5_2qzb6,t3_34g1us,t1_cqurdgr,0,,,IAmA,cqurdgr,,0,0,0,SirSwimmicus,1,1432708390,"You're definitely right, he didn't ever feel so far gone to the point where he was emotionally or mentally equivalent to Joffrey or Ramsay. The other two acted because they're psychopaths and they could. He was desperate and made mistakes, but it was because of the decisions he made. Every time he came to a crossroads in his life, he made a decision that took him farther away from the man that he started the series as. Not once did he seriously consider turning his back on cooking and trying to make amends. Every decision was conscious and ""logical,"" and brought him closer to being the man that he became. He fell into the role that he created for himself. The scary part about him was that he wasn't a psychopath; he was a husband with a wife and kids, who started as normal guy and ended up an evil human being, not because of what someone did to him, but because of choices he made thinking they were the right thing to do. He is evil because deep down, he believes all the decisions he made were the right ones. That man was there all along, waiting to get out.",,0,0,t1_cquhx7x
1430459073,4,t5_2sokd,t3_34ensf,t1_cqurdgs,0,,,explainlikeimfive,cqurdgs,,0,0,0,The_camperdave,4,1432708390,"There's a part that's missing from that video: mutual gravitational pull.  Imagine you have two planets orbiting a star, each in its own orbital plane.  When both planets are on the same side of the star, they are going to pull each other towards themselves, pulling the orbital planes closer together.  When they are on opposite sides of the star, the gravitational pull will try to pull the orbital planes apart, but since the distance is so much greater, the force is much, much less.",,0,0,t1_cqtw3tn
1430459073,1,t5_2qh55,t3_34h8id,t1_cqurdgt,0,,,food,cqurdgt,,0,0,0,dynamowhum59,1,1432708390,again. AND?,,0,0,t3_34h8id
1430459073,1,t5_2qhud,t3_34h1br,t1_cqurdgu,0,,,Metal,cqurdgu,,0,0,0,brutishbloodgod,1,1432708390,"Going a little bit more off what /u/Bronan_the_Brobarian said, anytime you see the word ""post-"" used to describe music, it can basically mean one of three things:  1. A post-modernist take on the style in question, which means that it takes the tropes of that style and criticizes and/or deconstructs them. 2. Influenced by music fitting the above definition (usually post-punk, post-hardcore, or post-rock), without necessarily being post-modernist itself. 3. ""Happened after."" Sometimes I see groove metal referred to as post-thrash because it's a thing that happened after thrash.  And like Bronan said, not a super useful label because it usually doesn't do much to describe the music. Most post-metal is atmospheric and/or progressive sludge. Most post-black metal is either atmospheric black or blackgaze.",,0,0,t3_34h1br
1430459073,3,t5_2qmg3,t3_34hm19,t1_cqurdgv,0,eagles,Eagles,nfl,cqurdgv,,0,0,0,DownTrunk,3,1432708390,I though for sure the cowboys were trading out of the first once Gordon went. Who you hoping for now?,,0,0,t1_cqurbkn
1430459073,2,t5_2v94d,t3_34him0,t1_cqurdgw,0,,CRRAAAABBBBB,starcitizen,cqurdgw,,0,0,0,firespikez,2,1432708390,"GHG, have you had any issues with the cryengine update that happened?",,0,0,t3_34him0
1430459073,2,t5_2rr81,t3_34gn4g,t1_cqurdgx,0,,,Warhammer40k,cqurdgx,,0,0,0,Schmitty777,2,1432708390,"Silly bot, wrong type of sloths.",,0,0,t1_cqurb7p
1430459073,1,t5_2qhl2,t3_34h6c3,t1_cqurdgy,0,,1980 Triumph TR7,cars,cqurdgy,,0,0,0,The_Lobotomite,1,1432708390,"1980 Triumph TR7.  My step dad bought it for just under $4k, and I bought it for $2,400!",,0,0,t3_34h6c3
1430459073,11,t5_2uzei,t3_34hiz7,t1_cqurdgz,0,,"The Whales are like ""YOOOOOO""",TwoBestFriendsPlay,cqurdgz,,0,0,0,kripsykrememcdonalds,11,1432708390,"Hahha your not wrong at all. To be fair he doesn't kidnap them, they come willingly after promises of adventures in time, so sort of like a space pedophile (he's 900 years old) with a creepy blue box instead of a van",,0,0,t1_cqur8gt
1430459073,2,t5_2qhrv,t3_34guqe,t1_cqurdh0,0,,,seduction,cqurdh0,,0,0,0,[deleted],2,1432708390,[deleted],,0,0,t1_cqumiu9
1430459073,2,t5_2qkd7,t3_34gc1y,t1_cqurdh1,0,,,rule34,cqurdh1,,0,0,0,mdogg500,2,1432708390,My brother sent me the body only swore it was a picture then sent me the unedited version ,,0,0,t3_34gc1y
1430459073,4,t5_2sgp1,t3_34fz3g,t1_cqurdh2,0,,,pcmasterrace,cqurdh2,,0,0,0,Annonimbus,4,1432708390,"Is it? Trust has been damaged. And I'm now more aware of how dangerous it is to be bound to one service.",,0,0,t1_cquou10
1430459073,2,t5_2v23y,t3_34hfp7,t1_cqurdh3,0,,,MaddenUltimateTeam,cqurdh3,,0,0,0,theycallmedoubled,2,1432708390,I pretty much replaced my entire line with these guys. Thanks man.,,0,0,t1_cqur2r0
1430459073,2,t5_36v9d,t3_34hljn,t1_cqurdh4,0,,,newsokur,cqurdh4,,0,0,0,rx109,2,1432708390,兄貴,,0,0,t3_34hljn
1430459073,1,t5_2qmg3,t3_34gud9,t1_cqurdh5,0,giants,Giants,nfl,cqurdh5,,0,0,0,uzi716,1,1432708390,"This has been the most ridiculous assumption about Pugh. He never actually played guard in college. Yes his size projects well to guard but to say that it is his natural position is beyond far fetched. Pugh and Flowers will compete for RT this year and while I do expect Pugh to be bumped inside I would not say that it is his natural position. There is still a learning curve for him, playing a completely new position. ",,0,0,t1_cqun7ae
1430459074,2,t5_2viyl,t3_34gegy,t1_cqurdh6,0,39stevonnie,I am an experience,stevenuniverse,cqurdh6,,0,0,0,-Maize,2,1432708390,"I KNOW AND IT MAKES ME SO SAD TO THINK THAT I WONT GET TO SEE SWORN TO THE SWORD FOR A WHILE, BECAUSE THAT EPISODE WAS GOING TO BE SO GOOD",,0,0,t1_cqupjzw
1430459074,2,t5_mouw,t3_34ft6e,t1_cqurdh7,0,,,science,cqurdh7,,0,0,0,jpoddweller,2,1432708390,You donating blood is still a hell of a lot cheaper and more reliable than enzymatically treating blood. So you should still feel good.,,0,0,t1_cqukkx7
1430459074,1,t5_2ssl0,t3_34hl4o,t1_cqurdh8,0,,,Animesuggest,cqurdh8,,0,0,0,HentaixSenpai,1,1432708390,Is there a big difference between the light novels and the anime? Is it worth reading 1-4? I guess would be a better question.,,0,0,t1_cqur6bp
1430459074,1,t5_2rnve,t3_34c52t,t1_cqurdh9,0,,,buildapc,cqurdh9,,0,0,0,OveRate,1,1432708390,If i try and change any settings it starts screen tearing terribly and tries blacking out the screen,,0,0,t1_cqtb74m
1430459074,1,t5_2t0cn,t3_34gxk1,t1_cqurdha,0,third-Zihark,,fireemblem,cqurdha,,0,0,0,Shephen,1,1432708390,Can I get some thoughts on my team? Not sure how good it is.,,0,0,t1_cquq8pm
1430459074,0,t5_2qore,t3_34gvb2,t1_cqurdhb,0,,,Diablo,cqurdhb,,0,0,0,Vadosi,0,1432708390,What is that chiltara? And how do you get it?,,0,0,t3_34gvb2
1430459074,6,t5_2r2o9,t3_34hlzc,t1_cqurdhc,0,Fisher,You wish you were a Fisher,asoiaf,cqurdhc,,0,0,0,bfisher91,6,1432708390,"I think it's just another hint that Jon was born while Ned was in Dorne. Meaning the only possible mothers for him are Lyanna or MAYBE Ashara. Wylla was literally just Jon's wet nurse as well, not his mother.",,0,0,t3_34hlzc
1430459075,35,t5_2tjsd,t3_34hjhu,t1_cqurdhd,0,,,Kappa,cqurdhd,,0,0,0,Sergeoff,35,1432708390,"Shoutouts to people with no imagination:  Tampa Bison, Kitasenju DJ, PR Balrog",,0,0,t1_cqur1xp
1430459075,2,t5_2s837,t3_34e4hd,t1_cqurdhe,0,flair-66,PS3,skyrim,cqurdhe,,0,0,0,TheScottymo,2,1432708390,"Well, looks like I've found my new background! ",,0,0,t3_34e4hd
1430459075,14,t5_2qh33,t3_34go40,t1_cqurdhf,0,,,funny,cqurdhf,,0,0,0,Also_bender,14,1432708390,"Awww, he still can't see without his glasses.",,0,0,t1_cquogzd
1430459075,0,t5_2rgs7,t3_34gzvo,t1_cqurdhg,0,gridania,Leviathan: Blake Wolf of CotP. Balmung: N/A,ffxiv,cqurdhg,,0,0,0,ShadowWolfCorey,0,1432708390,"When I found that bit out, ""Well, I'll now have a set of Atmas left over for the pretty colours."" Yes, I gathered four sets of each Atma for getting the Ragnarok, Longinus, Excalibur, and the now known to be nonexistant Dark Knight zodiac.  EDIT: [So I'm not doubted.]( http://imgur.com/8MVBcIS)",,0,1,t1_cquqi2x
1430459075,1,t5_2rbm7,t3_34hmbc,t1_cqurdhh,0,,,gameswap,cqurdhh,,0,0,0,SwapNSalebot,1,1432708390,  Username | Join date | Link karma | Comment karma :- | :-: | -: | -: ShineTipper | 01 May 2015 / &lt;1 year  | 1 | 0  ^^This ^^information ^^does ^^not ^^guarantee ^^a ^^successful ^^swap. ^^It ^^is ^^being ^^provided ^^to ^^help ^^potential ^^trade ^^partners  ^^have ^^more ^^immediate ^^background ^^information ^^about ^^with ^^whom ^^they ^^are ^^swapping. ,moderator,0,0,t3_34hmbc
1430459075,3,t5_2r78m,t3_34dtrf,t1_cqurdhi,0,,,perth,cqurdhi,,0,0,0,GoUnbuildWalls,3,1432708390,"laser tag is nerdy? coffee is ""too hipster""!?  What do people do for fun!?!?",,0,0,t1_cqtp9a2
1430459075,2,t5_2qjdm,t3_34gcyn,t1_cqurdhj,0,,,Advice,cqurdhj,,0,0,0,avest1007,2,1432708390,Kinda like Mr. Mxyzpltk from DC,,0,0,t1_cqudl2e
1430459075,3,t5_2qh1o,t3_34gqx4,t1_cqurdhk,0,,,aww,cqurdhk,,0,0,0,Sleepyhead88,3,1432708390,Make sure to hold off the caffeine for a while,,0,0,t3_34gqx4
1430459075,52,t5_2uii8,t3_34hfb2,t1_cqurdhl,0,,,marvelstudios,cqurdhl,,0,0,0,mixolydian807,52,1432708390,"Relax guys. The Movie was amazing. The rating is going to go up don't worry. It was better than the first one. Way better.",,0,0,t3_34hfb2
1430459075,4,t5_2qh3l,t3_34g48z,t1_cqurdhm,0,,,news,cqurdhm,,0,0,0,aabbccbb,4,1432708390,"&gt; What makes you think his cry was due to his injury and not just part of him resisting arrest?   Did you watch the video?  He wasn't resisting.  &gt;That crab position doesn't sound that unnatural to me  Baltimore PD, I presume?  &gt; I don't have an opinion either way  Sure you don't.  &gt; the narratives of THIS IS 100% WHAT HAPPENED are wrong because you cannot know, you assume  I never said 100%.  And they may not be wrong.  You just assumed, didn't you?  &gt; That assumption is based off your biases.   Right.  Of which you have none.  Clearly.  Okay.  Good talk.  ",,0,0,t1_cquprxj
1430459075,5,t5_2w0u7,t3_34hizy,t1_cqurdhn,0,,,AsianBeauty,cqurdhn,,0,0,0,MaddieEms,5,1432708390,"I use the Cosrx snail as a mid-routine hydrating step.  It layers very well, does not ball up or act weird, and is very hydrating.",,0,0,t1_cquqo4f
1430459075,1,t5_2qm4e,t3_34fjf2,t1_cqurdho,0,,,askscience,cqurdho,,0,0,0,[deleted],1,1432708390,[deleted],,0,0,t1_cquqout
1430459075,1,t5_2rfxx,t3_34hm7v,t1_cqurdhp,0,sona,,leagueoflegends,cqurdhp,,0,0,0,Billy2424,1,1432708390,"It's may 2nd",,0,0,t3_34hm7v
1430459075,1,t5_2qh33,t3_34gqj8,t1_cqurdhq,0,,,funny,cqurdhq,,0,0,0,fett4evr,1,1432708390,"I thought there were 3? Dicks, Pussies and Assholes.",,0,0,t3_34gqj8
1430459076,1,t5_2r090,t3_34d5ms,t1_cqurdhr,0,,"[Corpus Christi, TX]",cigars,cqurdhr,,0,0,0,TheTeleGuy,1,1432708390,"First Smoke: Marlboro Light, Short. Found on the golf course with my dad and he let me try because safety. First Cigar: RyJ something, I bought in a tube at WDW and smoked for my High School Graduation, with my dad",,0,0,t3_34d5ms
1430459076,1,t5_2y6r4,t3_34bykf,t1_cqurdhs,0,,http://steamcommunity.com/profiles/76561198008866059,GlobalOffensiveTrade,cqurdhs,,0,0,0,ggffee,1,1432708390,m9 night mw fv 0.074 + huntsman cw mw fv 0.077 for kara fade?,,0,0,t3_34bykf
1430459076,4,t5_2serw,t3_34hb40,t1_cqurdht,0,SC flag-cf,Combo Pipe-Fitter/Welder (V),Welding,cqurdht,,0,0,0,tryin_to_weld,4,1432708390,"If you think getting into a union is as easy as just filling out an application and you're in, you got another thing coming.   Pros: wages are some of the highest you'll find, benefits, pension, 401, etc  Cons: sometimes getting stuck on the books",,0,0,t3_34hb40
1430459076,1,t5_2zc5x,t3_34hm0f,t1_cqurdhu,0,PS4,,Fireteams,cqurdhu,,0,0,0,polidact,1,1432708390, 32 warlock .. Psn polidact ,,0,0,t3_34hm0f
1430459076,1,t5_37js8,t3_34h8rv,t1_cqurdhv,0,,,HaloOnline,cqurdhv,,0,0,0,MDGZ,1,1432708390,Will the new version use the original Halo Online main menu?  The ported Halo 3 one is a bit difficult to navigate and doesnt scale well to higher resolutions.,,0,0,t1_cquop4b
1430459076,1,t5_2ryfy,t3_34b9zt,t1_cqurdhw,0,,,DebateAnAtheist,cqurdhw,,0,0,0,McMeaty,1,1432708390,"&gt; Well, if you think that it is possible, then why bring it up?  I said I think it is possible?  Where? ",,0,0,t1_cqtjzbl
1430459076,2,t5_2t3or,t3_34h2tq,t1_cqurdhx,0,,"I like long walks on the beach, big dicks, and fried chicken",rupaulsdragrace,cqurdhx,,0,0,0,littlekittencapers,2,1432708390,"What if it pisses people off because Pearl sends Trixie home again with the same lipsync performance she's done the past two times?",,0,0,t3_34h2tq
1430459076,1,t5_2qhu8,t3_34hia9,t1_cqurdhy,0,,,aviation,cqurdhy,,0,0,0,HyFix,1,1432708390,Yes but why? Is there something significant going on with jblu? ,,0,0,t3_34hia9
1430459076,2,t5_2s2wi,t3_34eiap,t1_cqurdhz,0,,,popping,cqurdhz,,0,0,0,brunettetexan,2,1432708390,"Why does this remind me of popping my sister's back zits.  All we need is a giant eye balls at the top to symbolize me. ",,0,0,t3_34eiap
1430459076,6,t5_2qh3s,t3_34h0or,t1_cqurdi0,0,,,movies,cqurdi0,,0,0,0,thesirenlady,6,1432708390,"yeah i know that. i wonder what constitutes a solo hulk movie though. blast him off into space, add in GOTG cameos and you're good to go.",,0,0,t1_cqurca2
1430459076,1,t5_2rmfx,t3_34eb17,t1_cqurdi1,0,,,GetMotivated,cqurdi1,,0,0,0,IamHitmonlee,1,1432708390,"If you only had faith for the first sentence, you wouldn't need to read the explanation attached. Defeats the role of faith",,0,0,t3_34eb17
1430459076,2,t5_2qo4s,t3_34hg0m,t1_cqurdi2,0,Kings3,Kings,nba,cqurdi2,,0,0,0,Whyyougankme,2,1432708390,"Also the winner of game 1 wins the series around 75-80% of the time, which is another in the clips favor.  Nevertheless go spurs cuz griffon and Jordan annoy the hell out of me.",,0,0,t1_cquq2vt
1430459076,1,t5_2qmlu,t3_34hah8,t1_cqurdi3,0,current,Raptor 120 W/stillare,electronic_cigarette,cqurdi3,,0,0,0,Mr_Smexyknight,1,1432708390,I regularly vape at around 300 watts,,0,0,t3_34hah8
1430459076,1,t5_2qh16,t3_34gsns,t1_cqurdi4,0,,,technology,cqurdi4,,0,0,0,devon223,1,1432708390,"Yeah that's lame but I have T-Mobile and it doesn't count towards my usage. ",,0,0,t1_cqur8ru
1430459076,1,t5_2ya42,t3_34ebf8,t1_cqurdi5,0,blackpill,I was born a poor black pill,PurplePillDebate,cqurdi5,,0,0,0,anacrassis,1,1432708390,"To the point you make in your first paragraph: not being a literature major, would you construct your entire worldview around one school of literary analysis?  Because TRP essentially does that with evolutionary psychology.",,0,0,t1_cqu1qjc
1430459076,21,t5_2qh9a,t3_34gu31,t1_cqurdi6,0,,,worldpolitics,cqurdi6,,0,0,0,PoppaTitty,21,1432708390,Bush. Clinton. Bush. Obama. Clinton. ,,0,0,t3_34gu31
1430459076,5,t5_2r40o,t3_34h8jt,t1_cqurdi7,0,,,Marvel,cqurdi7,,0,0,0,BardicFire,5,1432708390,thats the point ;),,0,0,t1_cquoulv
1430459076,2,t5_2r0gj,t3_34fjqy,t1_cqurdi8,0,,,exmormon,cqurdi8,,0,0,0,SmurfBasin,2,1432708390,So the guys broke into their apartment? I hope they at least move them to a new living location.,,0,0,t1_cqu64kr
1430459076,2,t5_2qnv4,t3_34ecfn,t1_cqurdi9,0,c0c0c0,Meh...,bipolar,cqurdi9,,0,0,0,DrewciferCDXX,2,1432708390,"Spending habits?  What spending habits?  I'm perpetually broke.",,0,0,t3_34ecfn
1430459076,0,t5_2qh1i,t3_34gc1q,t1_cqurdia,0,,,AskReddit,cqurdia,,0,0,0,BigGreekMike,0,1432708390,Lmao at /r/Apple,,0,0,t1_cque0cq
1430459077,6,t5_2qsev,t3_34hl4l,t1_cqurdib,0,,,ufc,cqurdib,,0,0,0,role34,6,1432708390,"please, stop.  no one cares.  you're having a rough time, but it'll get better. this will be a funny story one day.  if you are doing drugs and drinking, then seek real help.  you're not going to find what your looking for here.",,0,0,t3_34hl4l
1430459077,1,t5_2qh03,t3_34g3rh,t1_cqurdic,0,,,gaming,cqurdic,,0,0,0,Sprinkles0,1,1432708390,"That's the only way.",,0,0,t1_cqugp1o
1430459077,6,t5_2qmg3,t3_34hay9,t1_cqurdid,0,chargers,Chargers,nfl,cqurdid,,0,0,0,edaddyo,6,1432708390,"Goddamn it, will someone buy him a TV for his bedroom already?! He's losing all his MOJO! ",,0,0,t3_34hay9
1430459077,0,t5_2vi60,t3_34gek7,t1_cqurdie,0,long,Architect,EliteDangerous,cqurdie,,0,0,0,Nouv,0,1432708390,"Thank you for your submission, /u/Brkari!  Unfortunately, your submission has been removed for the following reason(s):  * Screenshots of NPC names, station names, or funny dialog    ---  If you feel this action was taken in error, or would like better clarification or need further assistance, please don't hesitate to [message the mods](http://www.reddit.com/message/compose?to=%2Fr%2Felitedangerous&amp;subject=Mod%20action%20dispute&amp;message=Discussing [this post](http://www.reddit.com/r/EliteDangerous/comments/34gek7/good_news_everyone/%29:%0D%0D).  Thank you!",moderator,0,0,t3_34gek7
1430459077,1,t5_2raed,t3_34fz2d,t1_cqurdif,0,,,creepy,cqurdif,,0,0,0,Shadydiplomat,1,1432708390,Hera!,,0,0,t3_34fz2d
1430459077,8,t5_2zfwe,t3_34dd12,t1_cqurdig,0,,,milanavayntrub,cqurdig,,0,0,0,assappreciater,8,1432708390,http://i.imgur.com/G5tS3pP.gif,,0,0,t1_cqtojgp
1430459077,1,t5_2u489,t3_34ffy4,t1_cqurdih,0,Cross,Christian,TrueChristian,cqurdih,,0,0,0,GreatAreYouLord,1,1432708390,"Whoops, sorry about that! I suppose that's right, and I did make it clear to them that it's a constant struggle, but the way I put it could come off oddly, I'll make sure they do know that I'm always struggling next week, just because you're right, I kind of did put it both ways.   ",,0,0,t1_cquojuj
1430459077,2,t5_2qh33,t3_34gs32,t1_cqurdii,0,,,funny,cqurdii,,0,0,0,Patrikc,2,1432708390,"You can also right-click the progress bar and select ""Get video URL at current time""!",,0,0,t1_cquqdlj
1430459077,1,t5_2w7mz,t3_34h8h9,t1_cqurdij,0,,,Tinder,cqurdij,,0,0,0,irishemperor,1,1432708390,More BS http://imgur.com/xNsqQvt,,0,0,t3_34h8h9
1430459077,1,t5_2rj3j,t3_349p96,t1_cqurdik,0,,,CollegeBasketball,cqurdik,,0,0,0,tcollins37142,1,1432708390,"I'm pretty sure John Calipari has said this exact quote as well",,0,0,t1_cqsyr3k
1430459077,0,t5_2qh1u,t3_34goss,t1_cqurdim,0,,,Music,cqurdim,,0,0,0,Hanjobsolo1,0,1432708390,Nope. Record companies have too much money as is. The bands can make money by touring. Or ill listen to their album on GS and buy it if I like it.,,0,0,t1_cquk6xa
1430459077,1,t5_2qh1i,t3_34hiep,t1_cqurdin,0,,,AskReddit,cqurdin,,0,0,0,nord_vegr,1,1432708390,"I'm not bad. I'm just drawn that way.",,0,0,t1_cquqh4f
1430459077,1,t5_2yrq6,t3_34crwe,t1_cqurdio,0,,,PublicFreakout,cqurdio,,0,0,0,UmarAlKhattab,1,1432708390,"I always wonder why attacked the victim, but maybe psychologically she IS going to forgive him anyway",,0,0,t1_cqtjndl
1430459077,2,t5_31zab,t3_34gzf6,t1_cqurdip,0,,,techtalktoday,cqurdip,,0,0,0,jimrandom,2,1432708390,"Maybe I'll finally be able to download router firmwares over secure connections?  *cough* belkin, *cough* Linksys, *cough* Netgear *cough* NSA... er wait that one's not a router brand! Too bad I can't tell if I'm downloading from them or one of the official sites without http**s**.",,0,0,t3_34gzf6
1430459077,3,t5_2ssp3,t3_34fvyc,t1_cqurdiq,0,,,AskHistorians,cqurdiq,,0,0,0,AshkenazeeYankee,3,1432708390,"You need to be more specific than ""Western Societies"".  Both the average and median ""age at first marriage"" varied considerably across different parts of Western Europe and the American colonies in this period.  The following in based onthe book *The History of the European Family: Family life in early modern times (1500-1789)*, edited by David I. Kertzer and Marzio Barbagli  Contrary to popular sterotypes, young men and women in Early Modern Times had remarkably similar marraige patterns to the late 20th century -- The beestCanturbury, England in the 1690s, average age at first marriage was 26 for Women, and 28 for men.  The medivan values are a little lower, but not much.  In fact, age at first marraige seems to have reached a high of 26-30 for both men and women in the late 17th century, and then declined slightly over the course of the 18th century, by which point age at first marraige was close to 25 years old for men, and around 22 years old for women.  Keep in mind that these are averages.  I havn't read that book in several years, but I also want to mention that this varied regionally as well as over time.  Finally, most of these demographic data is based on church records of marragies, deaths, and births.  Relationships that took place outside of the state appartus don't show up in our records, nor do the family lives of religious and ethnic minorities (Jews, Roma, Basques, Travellers, etc).     Also, this data really only applies to urban-dwellers in France, England, Germany, and Northern Italy.  In other parts of Europe, and the greater Mediterrian basin, as well as in rural areas, there are some signs that these numbers are probably a little too high.  Basically, though, functional leigtimized teenage marraige was nowhere nearly as common as popular media suggests, at least for ordinary people in the period 1500-1800.  **TL;DR: For Western Europe, mid-to-late 20s was common for both men and women in the period 1500s-1790s.  However, the the discrepancy between the mean and the median suggests there's some important social and regional differences that complicate the picture.**",,0,0,t3_34fvyc
1430459077,2,t5_2qhsa,t3_349lnz,t1_cqurdir,0,,,interestingasfuck,cqurdir,,0,0,0,EtsuRah,2,1432708390,I have some news about scrapple for you too then.,,0,0,t1_cqurboc
1430459077,105,t5_2qh61,t3_34fvc8,t1_cqurdis,0,,,WTF,cqurdis,,0,0,0,Tastes_Of_Burning,105,1432708390,"&gt;  but the others are probably taking pictures to show their spouses.  My wife is a nurse - works in the ICU, but started in the Operating Room. Sure she tells me stories about what she's seen, we even laugh about it. She's never mentioned a patients name, and at no point has she ever taken a photo of the crazy shit (literally, ankle deep in shit once) she's bore witness to. Why? Because she takes HIPAA more serious than she does a heart attack.  There's absolutely no excuse for taking personal photos and videos of a patient receiving care.",,1430495134,0,t1_cquh30u
1430459077,1,t5_2rfqu,t3_34fv4b,t1_cqurdit,0,,,fakeid,cqurdit,,0,0,0,altra92,1,1432708390,"If you want I could send you pictures or scans in the morning...like I said I'm not trying to criticize...I'm just from Michigan and I know how they should look",,0,0,t1_cqupvpk
1430459077,2,t5_2vq0w,t3_34fs0c,t1_cqurdiu,0,,,DestinyTheGame,cqurdiu,,0,0,0,KillEvree1,2,1432708390,"It would be easy for Bungie to enable matchmaking for raid and appease the group who wants it.  However, these same people would than ask Bungie to police the game when matchmaking pools them with toxic players.  Bungie doesn't want to police the game.  That is why no matchmaking exists.    If you are one of those people who need matchmaking please use a 3rd party site like destinylfg.com.  Yes, it not as fast to 'start' a game.  However, remember two things.  One, if you have time to do the raid you have time to post on destinylfg and find a group.  Two, pick-up games are more successful than public matching.  ",,0,0,t3_34fs0c
1430459078,1,t5_2qjvn,t3_34ez2x,t1_cqurdiv,0,,,relationships,cqurdiv,,0,0,0,Kheran,1,1432708390,Hoo-Ha,,0,0,t1_cquhujy
1430459078,2,t5_2qh33,t3_34fj78,t1_cqurdiw,0,,,funny,cqurdiw,,0,0,0,ManateeSheriff,2,1432708390,"You gave me a scare, but I believe you have it wrong here. You put commas around an appositive when it is not essential to the meaning of the sentence. You leave them off if the sentence doesn't work without the information in the appositive.  In the case of proper nouns, the use of commas depends on the context. If I have multiple sisters, then the extra information is necessary to describe who I'm talking about, and her name should not be in commas. But if I only have one sister, then saying ""my sister"" narrows it down to one person, and thus her name is not essential and should be set off by commas.   http://snarkygrammarguide.blogspot.com/2010/08/commas-accentuating-appositive.html",,0,0,t1_cquqms9
1430459078,2,t5_2rjli,t3_34g1lh,t1_cqurdix,0,,16,teenagers,cqurdix,,0,0,0,UnicornFritters,2,1432708390,"Call the French Embassy in Washington and, with the help of Google translate, start talking about Norwegian fashion trends in Japanese.  Their number is (202) 944 6000",,0,0,t3_34g1lh
