created_utc,ups,subreddit_id,link_id,name,score_hidden,author_flair_css_class,author_flair_text,subreddit,id,removal_reason,gilded,downs,archived,author,score,retrieved_on,body,distinguished,edited,controversiality,parent_id
1430459104,1,t5_2rdi4,t3_34h0om,t1_cqurdu1,0,,,learnmath,cqurdu1,,0,0,0,autowikibot,1,1432708395,"#####&amp;#009;  ######&amp;#009;  ####&amp;#009; Section 1. [**Euclid's proof**](https://en.wikipedia.org/wiki/Euclid%27s_theorem#Euclid.27s_proof) of article  [**Euclid%27s theorem**](https://en.wikipedia.org/wiki/Euclid%27s%20theorem): [](#sfw)   ---  &gt;  &gt;[Euclid](https://en.wikipedia.org/wiki/Euclid) offered the following proof published in his work *[Elements](https://en.wikipedia.org/wiki/Euclid%27s_Elements)* (Book IX, Proposition 20),  which is paraphrased here.  &gt;Consider any finite list of prime numbers *p*1, *p*2, ..., *p**n*. It will be shown that at least one additional prime number not in this list exists. Let *P* be the product of all the prime numbers in the list: *P* = *p*1*p*2...*p**n*. Let *q* = *P* + 1. Then *q* is either prime or not:  &gt;   &gt;* If *q* is prime, then there is at least one more prime than is in the list.  &gt;   &gt;* If *q* is not prime, then some [prime factor](https://en.wikipedia.org/wiki/Prime_factor) *p* divides *q*. If this factor *p* were on our list, then it would divide *P* (since *P* is the product of every number on the list); but *p* divides *P* + 1 = *q*. If *p* divides *P* and *q,* then *p* would have to divide the difference  of the two numbers, which is (*P* + 1) − *P* or just 1. Since no prime number divides 1, this would be a contradiction and so *p* cannot be on the list. This means that at least one more prime number exists beyond those in the list.  &gt;This proves that for every finite list of prime numbers there is a prime number not on the list, and therefore there must be infinitely many prime numbers.  &gt;Euclid is often erroneously reported to have proved this result by [contradiction](https://en.wikipedia.org/wiki/Proof_by_contradiction), beginning with the assumption that the set initially considered contains all prime numbers, or that it contains precisely the *n* smallest primes, rather than any arbitrary finite set of primes.  Although the proof as a whole is not by contradiction (it does not assume that only finitely many primes exist), a proof by contradiction is within it, which is that none of the initially considered primes can divide the number *q* above.  &gt;  ---    ^Parent ^commenter ^can [^toggle ^NSFW](/message/compose?to=autowikibot&amp;subject=AutoWikibot NSFW toggle&amp;message=%2Btoggle-nsfw+cqurdu1) ^or[](#or) [^delete](/message/compose?to=autowikibot&amp;subject=AutoWikibot Deletion&amp;message=%2Bdelete+cqurdu1)^. ^Will ^also ^delete ^on ^comment ^score ^of ^-1 ^or ^less. ^| [^(FAQs)](http://www.np.reddit.com/r/autowikibot/wiki/index) ^| [^Mods](http://www.np.reddit.com/r/autowikibot/comments/1x013o/for_moderators_switches_commands_and_css/) ^| [^Magic ^Words](http://www.np.reddit.com/r/autowikibot/comments/1ux484/ask_wikibot/)",,0,0,t1_cqurdn5
1430459104,3,t5_2szyo,t3_34gyed,t1_cqurdu2,0,,,Showerthoughts,cqurdu2,,0,0,0,SuperNinjaBot,3,1432708395,Err so you obviously have not been blessed enough to watch a group of girls get ready to go out.    It truly does happen.  Zero sex so it doesnt end up in pornos but... yeah.    Sucks to be you guys.  ,,0,0,t1_cqulp1d
1430459104,2,t5_2rfxx,t3_34hi7z,t1_cqurdu3,0,,,leagueoflegends,cqurdu3,,0,0,0,bolofoo,2,1432708395,"I agree as well, I'm not saying that they should get pob, I just think that a tryout isn't a terrible idea as it is possible he might fit with c9. however if they went for na talent I would like for them to go with yusui as imo he has a higher ceiling than pob. I'd like them to get either yusui or incarnation.",,0,0,t1_cqurcly
1430459104,113,t5_2qh4i,t3_34h2s5,t1_cqurdu4,0,,,books,cqurdu4,,0,0,0,Babytrix,113,1432708395,"I don't know... At this point, I'm much less shocked when he kills people off, but on the flip side, I feel even more invested in my favourites that he hasn't axed.",,0,0,t1_cququ4r
1430459104,1,t5_32yw1,t3_348sr3,t1_cqurdu5,0,,New Guy 24/02/15,BitTippers,cqurdu5,,0,0,0,keihardhet,1,1432708395,"I'm awake now. The village looks very peaceful at daytime. I hear birds and a donkey... Looks like a perfect day to lynch in that new kitchen knife I bought at the market. A crowd gathers at Ispeakalittlespanish 's home and kills him. ",,0,0,t1_cqugha4
1430459104,3,t5_2x9xz,t3_34hgh5,t1_cqurdu6,0,,,fatpeoplehate,cqurdu6,,0,0,0,YourAmericanHero,3,1432708395,"&gt; You have no right of wanting people to be anything.   You have no self control when there's a plate of brownies on the table. ",,0,0,t3_34hgh5
1430459105,1,t5_2qh72,t3_34e7cl,t1_cqurdu7,0,,,Jokes,cqurdu7,,0,0,0,Putnum,1,1432708395,"I actually got this joke from work, someone had it printed up on the wall! :-) ",,0,0,t1_cqukuin
1430459105,3,t5_2v5mu,t3_34gi5i,t1_cqurdu8,0,,,ketogains,cqurdu8,,0,0,0,unicornial,3,1432708395,30%,,0,0,t3_34gi5i
1430459105,2,t5_2s580,t3_34hllq,t1_cqurdu9,0,io,,DotA2,cqurdu9,,0,0,0,ccrraapp,2,1432708395,"With the huge fan base, the compendium can get cheaper and still break the record for biggest prize pool.",,0,0,t3_34hllq
1430459105,1,t5_2sokd,t3_34el7h,t1_cqurdua,0,,,explainlikeimfive,cqurdua,,0,0,0,santaliqueur,1,1432708395,You know polls do not count total numbers right? They are extrapolated by their very nature. ,,0,0,t1_cquqx0z
1430459105,0,t5_2qtr8,t3_34d8oc,t1_cqurdub,0,signal,25Unicorn,army,cqurdub,,0,0,0,XiledRockstar,0,1432708395,brb looking for r/Chicago.,,0,0,t1_cqtuohe
1430459105,1,t5_2sl16,t3_34d5bv,t1_cqurduc,0,,,cumsluts,cqurduc,,0,0,0,Tshirt_Addict,1,1432708395,Cool,,0,0,t1_cqtwg6r
1430459105,1,t5_2qhix,t3_34eka3,t1_cqurdud,0,,King of the nitregs,poker,cqurdud,,0,0,0,dalonelybaptist,1,1432708395,"As I said, when I posted there was 2 comments",,0,0,t1_cquigai
1430459105,1,t5_2r05i,t3_34dwtg,t1_cqurdue,0,wolf,,Minecraft,cqurdue,,0,0,0,ZackZak30,1,1432708395,"Check out OP's profile and you can see it is indeed leaking",,0,0,t1_cqtt9mg
1430459105,1,t5_2qh61,t3_34fcgk,t1_cqurduf,0,,,WTF,cqurduf,,0,0,0,theboyfromganymede,1,1432708395,And now I need eyebleach.,,0,0,t3_34fcgk
1430459105,2,t5_2qm3q,t3_34gvdi,t1_cqurdug,0,,,mmo,cqurdug,,0,0,0,Zamalamin,2,1432708395,"Ok, so this is gonna be another long one just to warn you.  To answer your second question first, as it's the easiest, no they aren't limited AT ALL. Every class can use every weapon and every armor type and you'll see why that's important when I answer the second question. Basically if you wanted to be a Dragonknight in light armor with a restoration staff and heal people, you could.  On the topic of customization, this game has some of the most customization that there is on the market. The game uses a LAS or ""limited action set"" as your actionbar. Basically, you choose 5 abilities and an ultimate. That's it.  Your skill menu will have class skills with 3 sections (for DK there's a fire section, a dragon section, and an earth section), Weapon abilities, World abilities, and Guild abilities. Each of these sections has skills for you to choose. So if you wanted to pick up a 2h weapon and DPS as dragonknight you could mix 2h weapon skills with your class skills on your bar. I should also mention, you get 2 weapon sets that you swap between in combat. 2h/bow or dual wield/bow are the most common physical DPS combos for example.  You get abilities via skill points (which I mentioned previously). Leveling gives one skill point, every 3 skyshards gives 1, and some quests award them. Also, every level you can put a point in Magicka (class, staff, and mage's guild abilities), Health, or Stamina (weapon, Fighter's Guild, and Undaunted abilities).  Also, once you hit ""Veteran Levels"" you'll get into the Champion system which is basically a talent system that gives you minor boosts to your stats for progressing through end-game content and such.  And as with most MMOs, EVERY build you can think of is at least semi-viable, however there are obviously certain combinations which are better than others.  TL;DR Customization for days, every class can be every role, play what you want(unless you wanna be the very best like no one ever was).",,0,0,t1_cquqozt
1430459105,7,t5_2szyo,t3_34f8qj,t1_cqurduh,0,,,Showerthoughts,cqurduh,,0,0,0,Zachpeace15,7,1432708395,"All the way up the spine. Around the head, down the face. Down the torso and stomach. Down the penis. Skip over the sack to avoid dookie balls. Then to the taint where it starts again.",,0,0,t1_cque9ks
1430459105,2,t5_2t4qa,t3_345i6g,t1_cqurdui,0,,,Cyberpunk_Music,cqurdui,,0,0,0,Ishar_wyrm,2,1432708395,I bow to such an experienced warrior with humility *Bow*  :P,,0,0,t1_cqugb5h
1430459105,1,t5_36buk,t3_34du12,t1_cqurduj,0,press-6,59s,thebutton,cqurduj,,0,0,0,xtfftc,1,1432708395,"So you basically hope that when the timer hits 0, everything resets :)",,0,0,t1_cqu1lk3
1430459106,4,t5_2rh4c,t3_34eyee,t1_cqurdul,0,frankocean,,hiphopheads,cqurdul,,0,0,0,bobbyjoechan,4,1432708395,"*no no he's versatile*  /s",,0,0,t1_cqubwe7
1430459106,3,t5_2qh16,t3_34gsns,t1_cqurdum,0,,,technology,cqurdum,,0,0,0,DesertTripper,3,1432708395,"No, they didn't. Not once was the word ""piracy"" used.",,0,0,t1_cquldxo
1430459106,12,t5_2reen,t3_34gmql,t1_cqurdun,0,,,androidapps,cqurdun,,0,0,0,synthequated,12,1432708395,Multiple languages at once. ,,0,0,t1_cqurc1c
1430459106,1,t5_2qh33,t3_34hlxn,t1_cqurduo,0,,,funny,cqurduo,,0,0,0,Insane_Fool,1,1432708395,Is this original or taken from a real movie poster? ,,0,0,t3_34hlxn
1430459106,1,t5_2s3j5,t3_34bwzx,t1_cqurdup,0,1 f,Tesla Fan,teslamotors,cqurdup,,0,0,0,superOOk,1,1432708395,"Yeah I loved this ;) ""Gigafactory 1"" muhhahahahahaha",,0,0,t1_cqupytw
1430459106,5,t5_2qm7u,t3_34h7bl,t1_cqurduq,0,,,baseball,cqurduq,,0,0,0,spaceman_splifff,5,1432708395,Swinging for the fences!,,0,0,t3_34h7bl
1430459106,2,t5_30zvj,t3_34h1wj,t1_cqurdur,0,,,AndroidWear,cqurdur,,0,0,0,shadowdroid,2,1432708395,offline voice recognition,,0,0,t3_34h1wj
1430459106,4,t5_31k9i,t3_34hlxz,t1_cqurdus,0,psplus16,,bloodborne,cqurdus,,0,0,0,Killah883,4,1432708395,"Uh, A German Spy is playing through his.  It's not as super-informative as his usual LP style, but still very high quality.",,0,0,t3_34hlxz
1430459106,1,t5_2qiap,t3_33efks,t1_cqurdut,0,,Cyclists of Springfield,springfieldMO,cqurdut,,0,0,0,banjomin,1,1432708395,"[map](https://www.google.com/maps/place/Nathanael+Greene+Park/@37.171028,-93.328623,15z/data=!4m2!3m1!1s0x0:0x3f0c07ec3c22f092) It's south of the sunshine/scenic intersection.  If you're southbound its on the left, after the nathaniel greene apartments/townhouses",,0,0,t1_cqtxk0y
1430459106,2,t5_2r2jt,t3_34h97y,t1_cqurduu,0,,,TwoXChromosomes,cqurduu,,0,0,0,-Themis-,2,1432708395,"And the women just got vanilla shirts too, not baby dolls or any other fancy styling.",,0,1,t1_cqur87c
1430459106,1,t5_2s8vl,t3_34hfxr,t1_cqurduv,0,00barnes,,LAClippers,cqurduv,,0,0,0,REDUCE5231,1,1432708395,Yes you scared..,,0,0,t1_cquq87i
1430459106,1,t5_31k9i,t3_34fbvq,t1_cqurduw,0,,,bloodborne,cqurduw,,0,0,0,Inanimate_Legion,1,1432708395,"Alright, thanks.  Deleting previous comment.",,0,0,t1_cqurciz
1430459106,-11,t5_2qhu2,t3_34fq71,t1_cqurdux,0,,,nyc,cqurdux,,0,0,0,[deleted],-11,1432708395,[deleted],,0,0,t1_cqujvje
1430459106,1,t5_2s3yq,t3_349213,t1_cqurduy,0,jam,,AnimalCollective,cqurduy,,0,0,0,logarithmyk,1,1432708395,"Once upon a time  I stumbled across STGSTV on vinyl at a local record store. At the time I didn't value that album as much as I did the other AnCo albums. Biggest mistake of my fucking life was not buying that vinyl. I can't find it anywhere anymore. ",,0,0,t3_349213
1430459106,0,t5_2qh16,t3_34gsns,t1_cqurduz,0,,,technology,cqurduz,,0,0,0,[deleted],0,1432708395,[deleted],,0,0,t1_cqup6lr
1430459106,-11,t5_2r9tk,t3_34flzf,t1_cqurdv0,0,,,BDSMcommunity,cqurdv0,,0,0,0,Wildore,-11,1432708395,Interesting. Do you think you would feel differently if things had been discussed prior to the events?  Would things have been better with more communication?,,0,0,t1_cquq8ns
1430459106,0,t5_2qiel,t3_34hhj4,t1_cqurdv1,0,VANStickInRinkNHL,VANStickInRinkNHL,hockey,cqurdv1,,0,0,0,Otto_von_BigDick,0,1432708395,"We seem to agree then. I'm just raising doubts about it as a stat. ",,0,0,t1_cqur7cu
1430459107,2,t5_2s7tt,t3_34g0ie,t1_cqurdv2,0,,,AdviceAnimals,cqurdv2,,0,0,0,tigress666,2,1432708395,"Probably used to people making the mistake. I work at a pet store and have taken to asking people if they want water dispensers when they are buying food dispensers (the two look very similar) because it's a very common story to have some one return a feeder saying they tried putting water in it and it all came pouring out. Also noticing if they have 23 cans of one flavor and one of another asking if they meant to get that one flavor (or any other noticeable pattern where one doesn't fit the pattern).",,0,0,t3_34g0ie
1430459107,3,t5_2qi0a,t3_34gqwt,t1_cqurdv3,0,,,gamedev,cqurdv3,,0,0,0,ToplessTopmodel,3,1432708395,Hey that seems interesting!   While were are at it. Is there a sub that has a strong focus on algorithms?,,0,0,t3_34gqwt
1430459107,2,t5_2sq9y,t3_34bx03,t1_cqurdv4,0,,,MilitaryPorn,cqurdv4,,0,0,0,BrassBass,2,1432708395,:D,,0,0,t1_cqtpisz
1430459107,-6,t5_2s3qj,t3_34h58j,t1_cqurdv5,0,,,Bitcoin,cqurdv5,,0,0,0,rydan,-6,1432708395,How does it feel knowing you stole money from Amazon when you got that prime shipping?  This is a company with single digit profit margins that is notorious for not making a profit.,,0,0,t3_34h58j
1430459107,2,t5_2rjz2,t3_34b1l8,t1_cqurdv6,0,171,Hodor,gameofthrones,cqurdv6,,0,0,0,samuraiguitarist,2,1432708395,Thanks brotha!,,0,0,t1_cqtn1w4
1430459107,1,t5_2u4js,t3_34gv05,t1_cqurdv7,0,,,arrow,cqurdv7,,0,0,0,fl00rit,1,1432708395,Haha,,0,0,t1_cquo2jq
1430459107,1,t5_2qi58,t3_34e7hi,t1_cqurdv8,0,53,Toronto FC,soccer,cqurdv8,,0,0,0,Kluey,1,1432708395,"&gt; ever since he was first called up.  I don't think that's true. He earned his spot on the team and overtime *became* the star. ",,0,1,t1_cqu3eym
1430459107,1,t5_2uis2,t3_34fqci,t1_cqurdv9,0,,,crayonpop,cqurdv9,,0,0,0,newcastletosydney,1,1432708395,"14th where what? I can't see it any where on the Gaon charts.",,0,0,t3_34fqci
1430459107,1,t5_2v73m,t3_34gtgt,t1_cqurdva,0,,,galaxys5,cqurdva,,0,0,0,Daigi81,1,1432708395,"What's the error? Factory or aftermarket head unit?",,0,0,t3_34gtgt
1430459107,5,t5_2qka0,t3_34h731,t1_cqurdvb,0,pyrored-forcenormal,,tf2,cqurdvb,,0,0,0,Spartar3mix,5,1432708395,"I was just thinking about this a few days ago myself. Now we just need to assemble the rest of the spy's body parts into melee weapons. ",,0,0,t3_34h731
1430459107,1,t5_2s580,t3_34hllq,t1_cqurdvc,0,syllabear,"""Im on the internet, pretending to be retarded""",DotA2,cqurdvc,,0,0,0,jpcaintic,1,1432708395,Yay!,,1430459508,0,t3_34hllq
1430459107,1,t5_2zc5x,t3_34hme8,t1_cqurdvd,0,bungieday14,,Fireteams,cqurdvd,,0,0,0,AutoModerator,1,1432708395,"Your submission was removed because it does not include a required Game System/Console tag. Make sure you include the Game System/Tag in the title surrounded by brackets [], not parenthesis (), such as `[PS4] VoG NM LF3M`. Please check our [Announcement Post](https://www.reddit.com/r/Fireteams/comments/2xhz6c/announcement_new_title_requirements/) for information about tagging your submission properly, then resubmit it with the correct tag.  *I am a bot, and this action was performed automatically. Please [contact the moderators of this subreddit](/message/compose/?to=/r/Fireteams) if you have any questions or concerns.*",moderator,0,0,t3_34hme8
1430459107,3,t5_2qtwb,t3_34fnde,t1_cqurdve,0,,,childfree,cqurdve,,0,0,0,rattytattyrooroos,3,1432708395,"Yeah! Student at UK and current fence sitter although its more like 99% CF just I wouldn't be ready to get sterilized. I do dream of living all over the world after college, and I want to be able to afford nice things lol!",,0,0,t1_cqupt7q
1430459107,1,t5_2qjvn,t3_34hlrw,t1_cqurdvf,0,,,relationships,cqurdvf,,0,0,0,Wit4Breakfast,1,1432708395,"Firstly, you're 19. You've only know transitional phases in your life. This basically means you can't have commitment issues, you probably haven't even committed to who YOU are just yet.   Have fun. Be happy. Try new things and different people. ",,0,0,t3_34hlrw
1430459107,3,t5_2s580,t3_34hlur,t1_cqurdvg,0,slardar,,DotA2,cqurdvg,,0,0,0,agtk,3,1432708395,[Here are all the pages of the TI5 Compendium as of right now.](http://imgur.com/a/ISNsu),,0,0,t3_34hlur
1430459107,1,t5_2qlqq,t3_348pda,t1_cqurdvh,0,,,fantasyfootball,cqurdvh,,0,0,0,pocari123,1,1432708395,"On paper Lacy looks pretty consistent but I can see why Foster is seen as more consistent. Lacy has a bunch of his yards from catches while Foster (when healthy) is consistently grinding out 100 yd rushing games so you know that his floor is higher.   Good RBs are supposed to have that high floor because they can produce even when their QB is having an off day. I don't think Lacy can do that because he doesn't have enough rushing yards (fault of the team's) while we've seen Foster have monster rushing games. ",,0,0,t1_cqsro5b
1430459108,2,t5_2uao3,t3_34ee6t,t1_cqurdvi,0,,,trashy,cqurdvi,,0,0,0,GordonBombay102,2,1432708395,"Because only losers don't switch their geographic location upon graduating High school.",,0,0,t1_cqu5v03
1430459108,4,t5_2qh1u,t3_34goss,t1_cqurdvj,0,,,Music,cqurdvj,,0,0,0,Stuhl,4,1432708395,"&gt;If that displays nothing, your data is gone.  go to google and search for grooveshark playlist [your name] [name of your playlist] find your playlist and open a cached version. Click on ""Text only version""  it worked for me, but you have to remember the name of your playlists. If you remember your username(that one in your addresbar) or are able to get to your playlist page, you can see all your lists which helps hugely. So a search for grooveshark [your User Name] may be very helpful  Bonus Points: it's independent from your account and you can look for playlists from other guys you listened to...",,1430459355,0,t1_cqumxkj
1430459108,1,t5_2rnve,t3_34hkf3,t1_cqurdvk,0,,,buildapc,cqurdvk,,0,0,0,communistsquared,1,1432708395,"GTA V is known for being very CPU-intensive. after some searching it seems that you *will* be able to run it, but only on very low settings.",,0,0,t1_cqur9l9
1430459108,1,t5_2v23y,t3_34hiyr,t1_cqurdvl,0,,,MaddenUltimateTeam,cqurdvl,,0,0,0,divory39,1,1432708395,1. 95 Kevin Johnson (Hous) 2. 95 Trae Waynes (Min) 3. 95 Marcus Peters (KC) 3a. 94 Byron Jones (Dal) (104 Jumping!) ,,0,0,t3_34hiyr
1430459108,1,t5_2qgzt,t3_34e4w2,t1_cqurdvm,0,,,gadgets,cqurdvm,,0,0,0,xunszrox,1,1432708395,"No worries, cheers m8",,0,0,t1_cqucl7u
1430459108,1,t5_2ti4h,t3_34f466,t1_cqurdvn,0,,,mildlyinteresting,cqurdvn,,0,0,0,lm1435,1,1432708395,yes,,0,0,t1_cqur43l
1430459108,5,t5_2rjz2,t3_34exk5,t1_cqurdvo,0,,,gameofthrones,cqurdvo,,0,0,0,meta2401,5,1432708395,"For some odd reason, I sincerely believed Ramsey when he said he would never harm her. I do believe you are on the right track though. Perhaps Ramsey's whores will try something on Sansa?",,0,0,t1_cquo3lo
1430459108,1,t5_2qh1i,t3_34ffhl,t1_cqurdvp,0,,,AskReddit,cqurdvp,,0,0,0,Bigred2989,1,1432708395,"When I was a kid my dreams would have almost nothing to do with each other, except for one recurring series of events. Something would cause me to scream, then a few seconds later I would be pulled into another place, either a dark pit or into the sky. I remember one time where I found myself in my back yard, I looked up at the moon, screamed, looked back down to see two robots that looked like the ones from Short Circuit, who grabbed me and threw me into a hollow log. Next thing I know I'm flying over a metro train and then I wake up. It scared the shit out of me to sleep for years.",,0,0,t3_34ffhl
1430459108,2,t5_2r9vp,t3_34fzk9,t1_cqurdvq,0,,,trees,cqurdvq,,0,0,0,bamoosee,2,1432708395,Your jokes always leave me feeling satisfied.,,0,0,t1_cqul5n9
1430459108,1,t5_2vrf0,t3_34gvdu,t1_cqurdvr,0,,SEA,churning,cqurdvr,,0,0,0,LumpyLump76,1,1432708395,Read the Credit Card rules link on the sidebar for Citi.,,0,0,t1_cquqkfw
1430459108,2,t5_2qkhb,t3_34gcg8,t1_cqurdvs,0,,,melbourne,cqurdvs,,0,0,0,[deleted],2,1432708395,[deleted],,0,0,t1_cqupzuj
1430459108,14,t5_2qo4s,t3_34hbqi,t1_cqurdvt,0,Warriors3,Warriors,nba,cqurdvt,,0,0,0,IllegalThoughts,14,1432708395,http://i.imgur.com/jqtxIqg.jpg  http://cdn.playbuzz.com/cdn/38b52e20-92ca-42ec-a60a-814fc0fe5dc3/4507231c-dd0b-467b-820d-990e87e2ce73.jpg,,0,0,t1_cquojie
1430459108,33,t5_2qh61,t3_34gk66,t1_cqurdvu,0,,,WTF,cqurdvu,,0,0,0,ftc08,33,1432708395,**HONK**,,0,0,t1_cqupf9y
1430459108,1,t5_2s51j,t3_34epkd,t1_cqurdvv,0,full,Broncos,DenverBroncos,cqurdvv,,0,0,0,CO_Boiler,1,1432708395,"Calm down buddy... I am a Boilermaker so it's a term of endearment towards the school.",,0,0,t1_cquqtcw
1430459108,-2,t5_2qxih,t3_34fj5t,t1_cqurdvw,0,darkside,,swtor,cqurdvw,,0,0,0,villige_idiot,-2,1432708395,"You've never (or heard of someone who has) gotten out of  a speeding ticket with a warning?",,0,0,t1_cqub4h0
1430459109,3,t5_2qh1e,t3_34fjn0,t1_cqurdvx,0,,,videos,cqurdvx,,0,0,0,some_poop_on_my_dick,3,1432708395,Holy shit! That weird guy has the potential to look like Tom Cruise!,,0,0,t1_cquea4n
1430459109,1,t5_2qh1i,t3_34hgsr,t1_cqurdvy,0,,,AskReddit,cqurdvy,,0,0,0,tinyhousebuilder,1,1432708395,Cane sugar to start a new hive of course...then a light touch.  Or have you found a better method to start a hive?,,0,0,t1_cquqr9k
1430459109,5,t5_2qh1i,t3_34hjr5,t1_cqurdvz,0,,,AskReddit,cqurdvz,,0,0,0,Jux_,5,1432708395,"When you get gilded, you don't need to edit your post to thank them. Instead, reply to the ""your comment was gilded"" message in your inbox. Even though it's anonymous, the person who gilded you will still get it and they can choose to reply to reveal themselves. ",,0,0,t3_34hjr5
1430459109,3,t5_2rqhz,t3_34g8da,t1_cqurdw0,0,duck-logo-2,,AnaheimDucks,cqurdw0,,0,0,0,SmugglerYT-1300,3,1432708395,Hell yes!!!,,0,0,t3_34g8da
1430459109,0,t5_2td0c,t3_34bfwo,t1_cqurdw1,0,,,Netrunner,cqurdw1,,0,0,0,razcrux,0,1432708395,Jesus!,,0,0,t1_cqups7c
1430459109,2,t5_2qwwh,t3_34ee3e,t1_cqurdw2,0,,05 Altima 2.5S,Nissan,cqurdw2,,0,0,0,Colorfag,2,1432708395,Seems to happen with every car Nissan makes.  Their lower trim cars keep getting more expensive and they make a new model to fill the price gap.,,0,0,t1_cqub9k1
1430459109,13,t5_2qh33,t3_34go40,t1_cqurdw3,0,,,funny,cqurdw3,,0,0,0,andsoitgoes42,13,1432708395,"[Oh, he was stellar](http://i.imgur.com/qDSRMEV.jpg)",,0,0,t1_cqup15l
1430459109,1,t5_2qh33,t3_34fg2k,t1_cqurdw4,0,,,funny,cqurdw4,,0,0,0,balthamaisteri,1,1432708395,I love this episode.,,0,0,t3_34fg2k
1430459109,-1,t5_2qh1i,t3_34fvry,t1_cqurdw5,0,,,AskReddit,cqurdw5,,0,0,0,ghostofpennwast,-1,1432708395,About tree fiddy,,0,0,t1_cqukewx
1430459109,1,t5_351ir,t3_34gq25,t1_cqurdw6,0,celes2,,crusadersquest,cqurdw6,,0,0,0,Sekkushu,1,1432708395,"Yea, no.  Aram never grew on me, lol.  Only ranked or trolling in custom.  I got to the rank I wanted and I just dropped it immediately.  ",,0,0,t1_cqun3ox
1430459109,-1,t5_2qh33,t3_34f2xr,t1_cqurdw7,0,,,funny,cqurdw7,,0,0,0,[deleted],-1,1432708395,[deleted],,0,1,t3_34f2xr
1430459109,1,t5_2yt52,t3_34hmar,t1_cqurdw8,0,oddish petilil gogoat grass,"Oscar 2320-6989-3694 [Grass:Oddish,Petilil,Gogoat]",friendsafari,cqurdw8,,0,0,0,autopsia,1,1432708395,Added!,,0,0,t3_34hmar
1430459109,1,t5_2qqjc,t3_34ggh0,t1_cqurdw9,0,,,todayilearned,cqurdw9,,0,0,0,groovyinutah,1,1432708395,I love Vonnegut. ,,0,0,t3_34ggh0
1430459109,2,t5_2ub11,t3_34h13z,t1_cqurdwa,0,medalred,2079-9381-8418 | IGN: Haylz,Pokemongiveaway,cqurdwa,,0,0,0,SkydivingHaylz,2,1432708395,Sent! Enjoy :D,,0,0,t1_cqupxs4
1430459109,2,t5_2qo4s,t3_34grwg,t1_cqurdwb,0,76ers1,76ers,nba,cqurdwb,,0,0,0,PhiladelphiaIrish,2,1432708395,"[Don't forget Chuck.](http://25.media.tumblr.com/tumblr_majwjzEwrg1qaxo2mo1_500.png)",,0,0,t1_cquo0h3
1430459109,4,t5_2qh7k,t3_34h4wj,t1_cqurdwc,0,,,lockpicking,cqurdwc,,0,0,0,Iboughtat2i,4,1432708395,"Oh god I made a key for an [1880s Antique Oak TANTALUS Decanter](http://www.ebay.com/itm/like/301532793111?lpid=82&amp;chn=ps) that was one of those. This would have been so helpful at the time. Ended up looking up the thing on ebay for a picture of the key, cut it to rough shape then smoked and filed till it worked. Pain in my ass.",,1430459313,0,t3_34h4wj
1430459109,2,t5_2qh0u,t3_34gxzw,t1_cqurdwd,0,,,pics,cqurdwd,,0,0,0,tms10000,2,1432708395,"The embroidery machine is to embroidery what the 3D printer is to sculpting.  Incidentally, I suddenly realized I always wanted an embroidery machine and a 3D printer (I already knew about the 3D printer)",,0,0,t1_cqumhg8
1430459109,1,t5_31ev2,t3_34hdkq,t1_cqurdwe,0,,,19KidsandCounting,cqurdwe,,0,0,0,Hughhefs,1,1432708395,lllllllllllllllllllllllllll,,1432238652,0,t3_34hdkq
1430459110,14,t5_2qh1i,t3_34g5dq,t1_cqurdwg,0,,,AskReddit,cqurdwg,,0,0,0,tremblemortals,14,1432708396,"&gt; My grandmother also grew up absolutely dirt poor, never enough money to eat, so how she ended up at boarding school is a complete mystery.  I have relatives who went to boarding school and paid for it by doing chores around the school. It was a lot more common in previous generations. And if your grandmother's family was that poor, it might have been part of the reason she was sent off: she stops being a financial burden and instead provides for herself while also getting an education.",,0,0,t1_cqufqdz
1430459110,1,t5_2s7tt,t3_34hli3,t1_cqurdwh,0,,,AdviceAnimals,cqurdwh,,0,0,0,dreamymango,1,1432708396,"Yeah man, April 26th was a day I'll never forget. In song.",,0,0,t1_cqur74a
1430459110,7,t5_2qhbe,t3_34gduw,t1_cqurdwi,0,,,Frugal,cqurdwi,,0,0,0,[deleted],7,1432708396,[deleted],,0,0,t1_cqulqgl
